variable_id,domain,concepts,question_text,validation_phrase,validation_phrase_occurrences,validation_phrase_score
q099,Economic Perception,"country evaluation, temporal comparison, authoritarian rule",Where would you place our country on this scale during the period of [name of the most recent government under authoritarian rule]?,where would you place our,4,16.5
q100,Economic Perception,"country evaluation, temporal comparison, authoritarian rule, present government",Where would you place our country on this scale during the period of [name of the most recent government under authoritarian rule]? Where would you place our country under the present government?,under authoritarian rule]? where would,1,132.0
q101,Transition to Democracy,"democracy, temporal comparison, evaluation, national level",Where would you place our country on this scale during the period of [name of the most recent government under authoritarian rule]? To what extent would you want our country to be democratic now?,under authoritarian rule]? to what,1,132.0
q102,Transition to Democracy,"democracy, temporal comparison, expectation, national level",Where would you place our country on this scale during the period of [name of the most recent government under authoritarian rule]? Where do you expect our country to be in five years?,under authoritarian rule]? where do,1,132.0
q103,Suitability of Democracy,"democracy, evaluation, national level",Do you think democracy is suitable for our country?,you think democracy is suitable,1,132.0
q104,Government Satisfaction,"government, evaluation, satisfaction",How satisfied or dissatisfied are you with the current government?,how satisfied or dissatisfied are,1,132.0
q105,Freedom of Speech,"freedom of speech, evaluation, temporal comparison",Everyone is free to say what they think- is better than before?,everyone is free to say,9,4.888888888888889
q106,Freedom and Equality,"freedom of speech, equality, evaluation, temporal comparison",Everyone is free to say what they think- is better than before? Everyone is treated equally by the government- is better than before?,is better than before? everyone,1,132.0
q107,Citizen Influence,"citizen influence, evaluation, temporal comparison",Everyone is free to say what they think- is better than before? People like me can have an influence on government- is better than before?,is better than before? people,1,132.0
q108,Corruption Control,"corruption, evaluation, temporal comparison",Everyone is free to say what they think- is better than before? Corruption in politics and government is under control- is better than before?,is better than before? corruption,1,132.0
q109,Income Inequality,"income inequality, evaluation, temporal comparison",Everyone is free to say what they think- is better than before? The gap between the rich and the poor have narrowed- is better than before?,better than before? the gap,1,132.0
q110,Public Safety,"public safety, evaluation, temporal comparison",Everyone is free to say what they think- is better than before? Preventing crime and maintaining order- is better than before?,is better than before? preventing,1,132.0
q111,Economic Perception,"economic condition, evaluation, temporal comparison",Everyone is free to say what they think- is better than before? Economic development- is better than before?,is better than before? economic,1,132.0
q112,Economic Perception,"freedom of speech, evaluation, temporal comparison",Everyone is free to say what they think- is better than before? Judges and courts are free from political interference- is better than before?,is better than before? judges,1,132.0
q113,Economic Perception,"freedom of association, evaluation, temporal comparison",Everyone is free to say what they think- is better than before? You can join any organization you like- is better than before?,is better than before? you,1,132.0
q114,Corruption Perception,"corruption, local level",How widespread corruption in your local/municipal government?,how widespread corruption in your,2,46.66904755831214
q115,Corruption Perception,"corruption, national level",How widespread corruption in your local/municipal government? How widespread corruption in the national government?,your local/municipal government? how widespread,1,132.0
q116,Corruption Perception,"corruption, personal experience",anyone you know personally witnessed an act of corruption?,know personally witnessed an act,1,132.0
q116e,Corruption Perception,"corruption, personal experience",anyone you know personally witnessed ?,you know personally witnessed ?,1,132.0
q117,Value Judgment,"democracy, economic development",Which comes closest to your own opinion?,which comes closest to your,1,132.0
q118,Value Judgment,"democracy, economic development",Which comes closer to your own view?,which comes closer to your,2,46.66904755831214
q119,Value Judgment,"democracy, economic development",choose between democracy and economic development?,choose between democracy and economic,1,132.0
q120,Trust in Government,"evaluation, temporal comparison, personal opinion",Which comes closer to your own view?,which comes closer to your,2,46.66904755831214
q121,Trust in Government,"leadership, decision making, democracy",We should get rid of parliament and elections and have a strong leader decide things,should get rid of parliament,5,11.806438921198891
q122,Trust in Government,"leadership, decision making, democracy, opposition",We should get rid of parliament and elections and have a strong leader decide things No opposition party should be allowed to compete for power,strong leader decide things no,1,132.0
q123,Trust in Government,"leadership, decision making, military intervention",We should get rid of parliament and elections and have a strong leader decide things The military should come in to govern the country,leader decide things the military,1,132.0
q124,Trust in Government,"leadership, decision making, expertise",We should get rid of parliament and elections and have a strong leader decide things We should get rid of parliament and elections and have the experts decide everything,strong leader decide things we,1,132.0
q125,Trust in Government,"leadership, decision making, rule of law","We should get rid of parliament and elections and have a strong leader decide things It is ok for the government to disregard the law in order to deal with the situation, when the country is facing a diffi",strong leader decide things it,1,132.0
q126,Citizen Engagement,"participation, politics",I have the ability to participate in politics,have the ability to participate,1,132.0
q127,Citizen Engagement,"perceived complexity, understanding, politics",Politics and government seems so complicated that a person like me can't really understand what is going on,politics and government seems so,5,11.806438921198891
q128,Citizen Engagement,"perceived complexity, understanding, politics, power dynamics",Politics and government seems so complicated that a person like me can't really understand what is going on The nation is run by a powerful few and ordinary citizens cannot do much about it,is going on the nation,1,132.0
q129,Citizen Engagement,"perceived influence, politics, government",Politics and government seems so complicated that a person like me can't really understand what is going on People like me don't have any influence over what the government does,what is going on people,1,132.0
q130,Trust in Government,"government complexity, understanding, evaluation",Politics and government seems so complicated that a person like me can't really understand what is going on Our form of government is still the best for us,what is going on our,1,132.0
q131,Trust in Government,"government trustworthiness, evaluation, temporal comparison",Politics and government seems so complicated that a person like me can't really understand what is going on You can generally trust the people who run our government to do what is right,going on you can generally,1,132.0
q132,Participation in Politics,"education level, political participation, equality",People with little or no education should have as much say in politics as highly-educated people,people with little or no,1,132.0
q133,Trust in Government,"government leadership, decision-making, obedience",Government leaders are like the head of a family; we should all follow their decisions,leaders are like the head,9,4.888888888888889
q134,Censorship and Freedom of Speech,"government control, censorship, freedom of speech",Government leaders are like the head of a family; we should all follow their decisions The government should decide whether certain ideas should be allowed to be discussed in society,decisions the government should decide,1,132.0
q135,Social Cohesion,"community harmony, group organization, social disruption",Government leaders are like the head of a family; we should all follow their decisions Harmony of the community will be disrupted if people organize lots of groups,all follow their decisions harmony,1,132.0
q136,Judicial Independence,"judicial independence, executive branch influence, judicial decision-making","Government leaders are like the head of a family; we should all follow their decisions When judges decide important cases, they should accept the view of the executive branch",all follow their decisions when,1,132.0
q137,Legislative Power,"legislative power, executive branch power, government effectiveness","Government leaders are like the head of a family; we should all follow their decisions If the government is constantly checked by the legislature, it cannot possibly accomplish great things",their decisions if the government,1,132.0
q138,Trust in Government,"government leadership, morality, decision-making","Government leaders are like the head of a family; we should all follow their decisions If we have political leaders who are morally upright, we can let them decide everything",follow their decisions if we,1,132.0
q139,Social Cohesion,"social diversity, chaos, social order","Government leaders are like the head of a family; we should all follow their decisions If people have too many different ways of thinking, society will be chaotic",follow their decisions if people,1,132.0
q140,Trust in Government,"government leadership, decision-making, authority",Government leaders are like the head of a family; we should all follow their decisions The government should maintain ownership of major state-owned enterprises,decisions the government should maintain,1,132.0
q141,Trust in Government,"government leadership, decision-making, authority",Government leaders are like the head of a family; we should all follow their decisions The national government should have more authority over local decisions than it does now,follow their decisions the national,1,132.0
q142,National Identity,"national identity, cultural assimilation",Our country should defend our way of life instead of becoming more and more like other countries,our country should defend our,1,132.0
q143,National Identity,"sacrifice, national interest","For the sake of the national community/society, the individual should be prepared to sacrifice his personal interest","sake of the national community/society,",4,16.5
q144,National Identity,"sacrifice, individual status, collectivism","For the sake of the national community/society, the individual should be prepared to sacrifice his personal interest The state is like a big machine and the individual is but a small cog, with no independent status",his personal interest the state,1,132.0
q145,National Identity,"sacrifice, goal-oriented leadership, authoritarianism","For the sake of the national community/society, the individual should be prepared to sacrifice his personal interest The most important thing for a political leader is to accomplish his goals even if he has to ignore the established proc",his personal interest the most,1,132.0
q146,National Identity,"sacrifice, leadership conviction, non-compromise","For the sake of the national community/society, the individual should be prepared to sacrifice his personal interest If a political leader really believes in his position, he should refuse to compromise regardless of how many people disa",sacrifice his personal interest if,1,132.0
q147,Leadership Style,"tolerance, pluralism, open-mindedness",A political leader should tolerate the views of those who challenge his political ideals,leader should tolerate the views,1,132.0
q147a,Leadership Style,"tolerance, pluralism, closed-mindedness",A political leader should not tolerate the views of those who challenge his political ideals,political leader should not tolerate,2,46.66904755831214
q148,Leadership Style,"tolerance, pluralism, authoritarianism","A political leader should not tolerate the views of those who challenge his political ideals As long as a political leader enjoys majority support, he should implement his own agenda and disregard the view of the",challenge his political ideals as,1,132.0
relig1,Unknown,,Religion,religion,2,50.0
se002,Unknown,,gender,gender,2,50.0
se003,Unknown,,age group,age group,1,92.4
se003a,Unknown,,actual age,actual age,1,92.4
se004,Unknown,,marital status,marital status,2,32.66833329081849
se004a,Unknown,,Marital Status(Y/N),marital status(y/n),1,92.4
se005,Unknown,,education,education,4,10.0
se005a,Unknown,,education by year,education by year,1,132.0
se005b,Unknown,,education(four categories),education(four categories),1,92.4
se006,Unknown,,religion,religion,2,50.0
se007,Religious Beliefs,"religiosity, spirituality, faith",relgiosity,relgiosity,1,50.0
se008a,Household Demographics,"household size, population",n of household members,n of household members,1,132.0
se008b,Household Demographics,"household generations, family structure",household generations,household generations,1,92.4
se009,Economic Condition,"annual income, economic status, income distribution",annual income: national quintiles,annual income: national quintiles,1,132.0
se012a,Occupation and Employment,"main occupation, career, professional life",Main Occupation,main occupation,2,32.66833329081849
se012bcn,Occupation and Employment,"occupation, job, vocation",OCCUPATION,occupation,8,10.0
se012bhk,Occupation and Employment,"occupation, job, vocation",OCCUPATION(original),occupation(original),2,50.0
se012bjp,Occupation and Employment,"main occupation, career, professional life",main occupation(orginal),main occupation(orginal),1,92.4
se012bkr,Occupation and Employment,"occupation, job, vocation",Occupation(original),occupation(original),2,50.0
se012bmo,Occupation and Employment,"employment status, job market, labor force",employment,employment,1,50.0
se012bph,Unknown,,occupation (verbatim),occupation (verbatim),1,92.4
se012bth,Unknown,,Primary occupation of respondent,primary occupation of respondent,1,132.0
se012btw,Unknown,,(Respondent has a job) What is respondent's current occupation?,(respondent has a job) what,1,132.0
se014,Unknown,,language,language,1,50.0
se016,Unknown,,ethnicity,ethnicity,1,50.0
se017,Unknown,,subjective social status,subjective social status,1,132.0
yrsurvey,Unknown,,survey year,survey year,1,92.4
