variable_id,domain,concepts,question_text,value_labels
country,Unknown,,Country Code,1=Japan; 2=Hong Kong; 3=Korea; 4=Mainland China; 5=Mongolia; 6=Philippines; 7=Taiwan; 8=Thailand; 9=Indonesia; 10=Singapore; 11=Vietnam; 12=Cambodia; 13=Malaysia
fgnum,Unknown,,Number of formal group,0=None; 1=One; 2=Two; 3=Three; 98=Not applicable
idnumber,Unknown,,"Interview Numbers 

Variable: level3 
  Question: Urban-rural",1=Urban; 2=Rural; 3=No registration
ir12a,Infrastructure Quality,"road condition, residence accessibility, infrastructure evaluation",What is the condition of the road leading to the interviewee's residence?,"1=Wide enough for car and paved with asphalt, cement or man-made materials; 2=Not wide enough for car, but paved with asphalt; 3=Paved with stone; 4=Unpaved/dirt road; 5=Muddy; 6=Others"
ir12b,Service Accessibility,"water source, drinking water quality, basic service availability",Is tap water the main source of drinking water?,0=Can't determine; 1=Yes; 2=No
ir12c,Service Accessibility,"electricity access, lighting source, energy availability",Is electricity the main source of lighting?,0=Can't determine; 1=Yes; 2=No
ir12d,Transportation Accessibility,"public transportation proximity, residence distance, transportation convenience",How far is it between the nearest public transportation stop and the respondent's house?,0=Can't determine; 1=Less than 10 minutes by walking; 2=Less than 20 minutes; 3=Less than 40 minutes; 4=Less than an hour; 5=Less than two hours; 6=Less than three hours; 7=Less than four hours; 8=More than four hours; 9=No stop
ir13a,Transportation Accessibility,"public transportation proximity, post-office distance, service accessibility",How far is it between the nearest public transportation stop and the respondent's house? Post-office,0=No; 1=Yes; 3=Not sure; 7=Not applicable; 9=Can't determine
ir13b,Education Accessibility,"school proximity, education access, public service distance",How far is it between the nearest public transportation stop and the respondent's house? School,0=No; 1=Yes; 3=Not sure; 7=Not applicable; 9=Can't determine
ir13d,Service Accessibility,"sewerage system access, waste management quality, public health infrastructure",How far is it between the nearest public transportation stop and the respondent's house? Sewerage system that most houses could access,0=No; 1=Yes; 3=Not sure; 7=Not applicable; 9=Can't determine
ir13e,Service Accessibility,"distance, public transportation, health service",How far is it between the nearest public transportation stop and the respondent's house? Health clinic,0=No; 1=Yes; 3=Not sure; 7=Not applicable; 9=Can't determine
ir13f,Service Accessibility,"distance, public transportation, telecommunication",How far is it between the nearest public transportation stop and the respondent's house? Signal for cellular phone,0=No; 1=Yes; 3=Not sure; 7=Not applicable; 9=Can't determine
ir13g,Service Accessibility,"distance, public transportation, recreational facilities","How far is it between the nearest public transportation stop and the respondent's house? Recreational facilities, e.g., a sports field",0=No; 1=Yes; 3=Not sure; 7=Not applicable; 9=Can't determine
ir13h,Service Accessibility,"distance, public transportation, place of worship","How far is it between the nearest public transportation stop and the respondent's house? Any churches, mosques, temples or other public places of worship",0=No; 1=Yes; 3=Not sure; 7=Not applicable; 9=Can't determine
ir13i,Service Accessibility,"distance, public transportation, community facilities",How far is it between the nearest public transportation stop and the respondent's house? Any town halls or community buildings that can be used for meetings,0=No; 1=Yes; 3=Not sure; 7=Not applicable; 9=Can't determine
ir13k,Service Accessibility,"distance, public transportation, market access",How far is it between the nearest public transportation stop and the respondent's house? Market stalls (selling groceries and/or clothing),0=No; 1=Yes; 3=Not sure; 7=Not applicable; 9=Can't determine
ir14,Geographic Location,"residence location, administrative level",Which of the following levels within the country the respondent live?,1=Capital or Megacity; 2=Regional center or Other major cities; 3=Small city or town; 4=Village or countryside; 5=Suburb; 6=Remote area; 7=Cannot choose
ir2,Survey Administration,"interviewer experience, questionnaire completion",Is this the first questionnaire interviewers have completed?,1=Yes; 2=No; 8=Not the first interviewer
ir2a,Interviewer Characteristics,interviewer gender,Interviewer's gender,0=Not applicable/Not the first interview; 1=Male; 2=Female
ir2b,Interviewer Characteristics,interviewer age,Interviewer's age,90=Not applicable/Not the first interview; 99=Decline to answer
ir3,Interview Environment,"interview setting, presence of others, privacy","In the interview, other than the respondents, were others present?",0=Can't determine; 1=Yes; 2=No
ir3a_1,Interview Environment,"family presence, spouse, interview setting",Spouse,0=Not applicable; 1=Yes; 2=No
ir3a_2,Interview Environment,"family presence, children, interview setting",Children,0=Not applicable; 1=Yes; 2=No
ir3a_3,Interview Environment,"family presence, parents, interview setting",Parents or parents in law,0=Not applicable; 1=Yes; 2=No
ir3a_4,Interview Environment,"external presence, neighbors, interview setting",Neighbors/Passers by,0=Not applicable; 1=Yes; 2=No
ir3a_5,Interview Environment,"external presence, government official, interview setting",Party/Government Official,0=Not applicable; 1=Yes; 2=No
ir3a_6,Interview Environment,"external presence, others, interview setting",Others,0=Not applicable; 1=Yes; 2=No
ir4,Respondent Behavior,"refusal to participate, interview process, respondent behavior",Has the respondent ever refused to be interviewed during the whole process?,0=Can't determine; 1=Yes. Right at the beginning of the interview; 2=Yes. In the middle of the interview; 3=Yes. Towards the end of the interview; 4=Never
ir5,Respondent Behavior,"impatience, interview experience, respondent behavior",Has the respondent ever felt impatient during the interview?,0=Can't determine; 1=Never; 2=Occasionally; 3=Sometimes; 4=Always
ir6,Respondent Behavior,"cooperation, interview process, respondent behavior",How cooperative was the respondent during the interview?,0=Can't determine; 1=Highly cooperative; 2=Fairly cooperative; 3=Not very cooperative
ir7,Survey Quality,"sincerity, response quality, interview assessment",How sincere was the respondent when answering sensitive questions?,0=Can't determine; 1=Highly sincerely; 2=Fairly sincere; 3=Not very sincere; 4=HIghly insincerely
ir8,Survey Quality,"difficulty, question comprehension, response ease",What proportion of the questions do you feel the respondent had difficulty answering?,0=Can't determine; 1=All; 2=Most; 3=Some; 4=Few; 5=None
ir9_1,Interview Metadata,"interview date, month, temporal information",What proportion of the questions do you feel the respondent had difficulty answering? Date of interview: month,1=January; 2=February; 3=March; 4=April; 5=May; 6=June; 7=July; 8=August; 9=September; 10=October; 11=November; 12=December
ir9_2,Interview Metadata,"interview date, day, temporal information","Date of interview: day 

Variable: ir9_3 
  Question: Date of interview: year 

Variable: ir10a 
  Question: Was the interview conducted with the assistance of an interpreter?",0=Can't determine; 1=Yes; 2=No
irII13c,Infrastructure Accessibility,"public transportation, distance, police station proximity",How far is it between the nearest public transportation stop and the respondent's house? Police station,0=No; 1=Yes; 3=Not sure; 7=Not applicable; 9=Can't determine
q1,Economic Perception,"economic condition, national level, current evaluation",How would you rate the overall economic condition of our country today?,1=Very bad; 2=Bad; 3=So so (not good nor bad); 4=Good; 5=Very good; 8=Can't choose; 9=Decline to answer
q10,Economic Perception,"family economic situation, future outlook, temporal projection",What do you think the economic situation of your family will be a few years from now? Trust in Political parties,1=None at all; 2=Not Very Much Trust; 3=Quite a Lot of Trust; 4=A Great Deal of Trust; 7=Do not understand the question; 8=Can't choose; 9=Decline to answer
q100,Political Priorities,"national issues, government priorities, public opinion","In your opinion, what are the most important questions facing the country that government should address?","0=No answer; 100=Economics; 110=Management of the economy, economic development; 120=Wages, incomes and salaries (or income gap) , pension; 130=Unemployment; 140=Poverty and destitution; 150=Rates and taxes; 160=Loans, credit, debt; 170=Land privatization; 180=Inflation; 190=International Trade, globalization; 191=Basic necessities (price of rice, fuel, spicy. etc); 200=Food / Agriculture / Environment; 210=Farming/ agriculture/ fishing/ Animal husbandry; 220=Food shortage/famine; 230=Natural disaster (drought, flood, earthquake, hurricane, etc; 240=Land; 250=Environment; 260=Natural resources; 300=Infrastructure; 310=Transportation; 320=Communications; 330=Infrastructure / roads; 400=Government Services; 410=Education, educational fee; 420=Science and technology; 430=Housing; 440=Electricity; 450=Water supply; 460=Orphans/street children/homeless children; 470=Social security, social welfare; 480=Services (other); 500=Health; 510=Health (medical care); 520=AIDS (and other transmissible diseases); 530=Sickness / Disease; 540=Public health, hygiene; 550=Food and drug safety; 600=Governance; 610=Crime and Security; 620=Corruption; 630=Political violence; 640=Political instability/political divisions/ ethnic tensions; 650=Discrimination/ inequality; 660=Gender issues/women's rights, children's rights; 670=Democracy/political rights, protection of rights; 680=Malfunction of political institutions; 690=Government efficiency; 691=Constitution; 692=Budget deficit; 693=Judiciary; 694=Administrative procedure; 695=Public service independence from politics; 696=Irresponsible leader/government; 700=General Social and Political Conditions; 710=Immigration; 720=Social anomaly (suicide, divorce, moral breakdown); 730=Aging population, fewer children; 740=Growth of population; 750=Cultural problems under social change; 751=Religion problem; 752=Culture preservation; 760=War (international); 770=Civil war; 780=External relations (foreign relations); 790=Terrorism; 791=National defense; 800=Country-Specific Problems; 990=Nothing/ no problems; 991=No further reply; 995=Other issues; 996=Unclassifiable, inconceivable; 998=Can't choose; 999=Decline to answer"
q101,Political Priorities,"national issues, government priorities, public opinion, multiple responses","In your opinion, what are the most important questions facing the country that government should address? Second Response","0=No answer; 100=Economics; 110=Management of the economy, economic development; 120=Wages, incomes and salaries (or income gap) , pension; 130=Unemployment; 140=Poverty and destitution; 150=Rates and taxes; 160=Loans, credit, debt; 170=Land privatization; 180=Inflation; 190=International Trade, globalization; 191=Basic necessities (price of rice, fuel, spicy. etc); 200=Food / Agriculture / Environment; 210=Farming/ agriculture/ fishing/ Animal husbandry; 220=Food shortage/famine; 230=Natural disaster (drought, flood, earthquake, hurricane, etc; 240=Land; 250=Environment; 260=Natural resources; 300=Infrastructure; 310=Transportation; 320=Communications; 330=Infrastructure / roads; 400=Government Services; 410=Education, educational fee; 420=Science and technology; 430=Housing; 440=Electricity; 450=Water supply; 460=Orphans/street children/homeless children; 470=Social security, social welfare; 480=Services (other); 500=Health; 510=Health (medical care); 520=AIDS (and other transmissible diseases); 530=Sickness / Disease; 540=Public health, hygiene; 550=Food and drug safety; 600=Governance; 610=Crime and Security; 620=Corruption; 630=Political violence; 640=Political instability/political divisions/ ethnic tensions; 650=Discrimination/ inequality; 660=Gender issues/women's rights, children's rights; 670=Democracy/political rights, protection of rights; 680=Malfunction of political institutions; 690=Government efficiency; 691=Constitution; 692=Budget deficit; 693=Judiciary; 694=Administrative procedure; 695=Public service independence from politics; 696=Irresponsible leader/government; 700=General Social and Political Conditions; 710=Immigration; 720=Social anomaly (suicide, divorce, moral breakdown); 730=Aging population, fewer children; 740=Growth of population; 750=Cultural problems under social change; 751=Religion problem; 752=Culture preservation; 760=War (international); 770=Civil war; 780=External relations (foreign relations); 790=Terrorism; 791=National defense; 800=Country-Specific Problems; 990=Nothing/ no problems; 991=No further reply; 995=Other issues; 996=Unclassifiable, inconceivable; 998=Can't choose; 999=Decline to answer"
q102,Political Priorities,"national issues, government priorities, public opinion, multiple responses","In your opinion, what are the most important questions facing the country that government should address? Third Response","0=No answer; 100=Economics; 110=Management of the economy, economic development; 120=Wages, incomes and salaries (or income gap) , pension; 130=Unemployment; 140=Poverty and destitution; 150=Rates and taxes; 160=Loans, credit, debt; 170=Land privatization; 180=Inflation; 190=International Trade, globalization; 191=Basic necessities (price of rice, fuel, spicy. etc); 200=Food / Agriculture / Environment; 210=Farming/ agriculture/ fishing/ Animal husbandry; 220=Food shortage/famine; 230=Natural disaster (drought, flood, earthquake, hurricane, etc; 240=Land; 250=Environment; 260=Natural resources; 300=Infrastructure; 310=Transportation; 320=Communications; 330=Infrastructure / roads; 400=Government Services; 410=Education, educational fee; 420=Science and technology; 430=Housing; 440=Electricity; 450=Water supply; 460=Orphans/street children/homeless children; 470=Social security, social welfare; 480=Services (other); 500=Health; 510=Health (medical care); 520=AIDS (and other transmissible diseases); 530=Sickness / Disease; 540=Public health, hygiene; 550=Food and drug safety; 600=Governance; 610=Crime and Security; 620=Corruption; 630=Political violence; 640=Political instability/political divisions/ ethnic tensions; 650=Discrimination/ inequality; 660=Gender issues/women's rights, children's rights; 670=Democracy/political rights, protection of rights; 680=Malfunction of political institutions; 690=Government efficiency; 691=Constitution; 692=Budget deficit; 693=Judiciary; 694=Administrative procedure; 695=Public service independence from politics; 696=Irresponsible leader/government; 700=General Social and Political Conditions; 710=Immigration; 720=Social anomaly (suicide, divorce, moral breakdown); 730=Aging population, fewer children; 740=Growth of population; 750=Cultural problems under social change; 751=Religion problem; 752=Culture preservation; 760=War (international); 770=Civil war; 780=External relations (foreign relations); 790=Terrorism; 791=National defense; 800=Country-Specific Problems; 990=Nothing/ no problems; 991=No further reply; 995=Other issues; 996=Unclassifiable, inconceivable; 998=Can't choose; 999=Decline to answer"
q102a,Trust in Government,"government effectiveness, problem solving, likelihood",How likely is it that the government will solve the most important problem you identified?,0=Not applicable; 1=Very likely; 2=Likely; 3=Not very likely; 4=Not at all likely; 7=No answer; 8=Can't choose; 9=Decline to answer
q103,Trust in Government,"government accountability, power to change, likelihood",How likely is it that the government will solve the most important problem you identified? People have the power to change a government they don't like,1=Strongly agree; 2=Somewhat agree; 3=Somewhat disagree; 4=Strongly disagree; 7=Do not understand the question; 8=Can't choose; 9=Decline to answer
q104,Trust in Government,"government accountability, rule of law, likelihood",How likely is it that the government will solve the most important problem you identified? Our current courts always punish the guilty even if they are high-ranking officials,1=Strongly agree; 2=Somewhat agree; 3=Somewhat disagree; 4=Strongly disagree; 7=Do not understand the question; 8=Can't choose; 9=Decline to answer
q105,Electoral Fairness,"equal access, mass media, election period",Political parties or candidates in our country have equal access to the mass media during the election period,1=Strongly agree; 2=Somewhat agree; 3=Somewhat disagree; 4=Strongly disagree; 7=Do not understand the question; 8=Can't choose; 9=Decline to answer
q106,Government Accountability,"government responsibility, accountability mechanisms, elections","Between elections, the people have no way of holding the government responsible for its actions",1=Strongly agree; 2=Somewhat agree; 3=Somewhat disagree; 4=Strongly disagree; 7=Do not understand the question; 8=Can't choose; 9=Decline to answer
q107,Rule of Law,"government accountability, legal system, law enforcement","When the government breaks the laws, there is nothing the legal system can do",1=Strongly agree; 2=Somewhat agree; 3=Somewhat disagree; 4=Strongly disagree; 7=Do not understand the question; 8=Can't choose; 9=Decline to answer
q108,Government Fairness,"equal treatment, government actions, fairness",Everyone is treated equally by the government,1=Strongly agree; 2=Somewhat agree; 3=Somewhat disagree; 4=Strongly disagree; 7=Do not understand the question; 8=Can't choose; 9=Decline to answer
q109,Basic Needs,"basic necessities, poverty, wellbeing","People have basic necessities like food, clothes, and shelter",1=Strongly agree; 2=Somewhat agree; 3=Somewhat disagree; 4=Strongly disagree; 7=Do not understand the question; 8=Can't choose; 9=Decline to answer
q11,Economic Perception,"economic situation, family wellbeing, future evaluation",What do you think the economic situation of your family will be a few years from now? Trust in Parliament,1=None at all; 2=Not Very Much Trust; 3=Quite a Lot of Trust; 4=A Great Deal of Trust; 7=Do not understand the question; 8=Can't choose; 9=Decline to answer
q110,Freedom of Speech,"freedom of expression, fear of retribution, government restrictions",People are free to speak what they think without fear,1=Strongly agree; 2=Somewhat agree; 3=Somewhat disagree; 4=Strongly disagree; 7=Do not understand the question; 8=Can't choose; 9=Decline to answer
q111,Freedom and Security,"freedom of association, fear of retribution, personal security",People can join any organization the like without fear,1=Strongly agree; 2=Somewhat agree; 3=Somewhat disagree; 4=Strongly disagree; 7=Do not understand the question; 8=Can't choose; 9=Decline to answer
q112,Trust in Government,"government transparency, information withholding, public trust",How often do government officials withhold important information from the public view?,1=Always; 2=Most of the time; 3=Occasionally; 4=Rarely; 7=Do not understand the question; 8=Can't choose; 9=Decline to answer
q113,Rule of Law,"government accountability, lawfulness, official conduct",How often do national government officials abide by the law? (HK: Hong Kong government),1=Always; 2=Most of the time; 3=Sometimes; 4=Rarely; 7=Do not understand the question; 8=Can't choose; 9=Decline to answer
q114,Democracy and Elections,"electoral choice, party competition, voter representation",How often do your think our elections offer the voters a real choice between different parties/candidates?,1=Always; 2=Most of the time; 3=Sometimes; 4=Rarely; 7=Do not understand the question; 8=Can't choose; 9=Decline to answer
q115,Government Oversight,"legislative power, government accountability, checks and balances",To what extent is the legislature capable of keeping the government in check?,1=Very capable; 2=Capable; 3=Not capable; 4=Not at all capable; 7=Do not understand the question; 8=Can't choose; 9=Decline to answer
q116,Government Responsiveness,"government responsiveness, public needs, policy implementation",How well do you think the government responds to what people want?,1=Very responsive; 2=Largely responsive; 3=Not very responsive; 4=Not responsive at all; 7=Do not understand the question; 8=Can't choose; 9=Decline to answer
q117,Corruption Perception,"local corruption, bribe-taking, municipal government",How widespread do you think corruption and bribe-taking are in your local/municipal government?,1=Almost everyone is corrupt; 2=Most officials are corrupt; 3=Not a lot of officials are corrupt; 4=Hardly anyone is involved; 8=Can't choose; 9=Decline to answer
q118,Corruption Perception,"national corruption, bribe-taking, government corruption",How widespread do you think corruption and bribe-taking are in the national government?,1=Almost everyone is corrupt; 2=Most officials are corrupt; 3=Not a lot of officials are corrupt; 4=Hardly anyone is involved; 8=Can't choose; 9=Decline to answer
q119,Corruption Experience,"personal experience, corruption witness, government official misconduct",Have you or anyone you know personally witnessed an act of corruption or bribe-taking by a politician or government official in the past year?,1=Witnessed; 2=Never witnessed; 7=Do not understand the question; 8=Can't choose; 9=Decline to answer
q119_1,Corruption Experience,"personal witness, corruption observation, government official wrongdoing",Have you or anyone you know personally witnessed an act of corruption or bribe-taking by a politician or government official in the past year? 119_1 Personally witnessed,0=Not applicable; 1=Yes; 2=No; 7=Do not understand; 8=Can't choose; 9=Decline to answer
q119_2,Corruption Perception,"corruption, personal experience, government official",Have you or anyone you know personally witnessed an act of corruption or bribe-taking by a politician or government official in the past year? 119_2 Told about it by family member,0=Not applicable; 1=Yes; 2=No; 7=Do not understand; 8=Can't choose; 9=Decline to answer
q119_3,Corruption Perception,"corruption, personal experience, government official",Have you or anyone you know personally witnessed an act of corruption or bribe-taking by a politician or government official in the past year? 119_3 Told about it by friend,0=Not applicable; 1=Yes; 2=No; 7=Do not understand; 8=Can't choose; 9=Decline to answer
q12,Economic Perception,"economic condition, family level, future evaluation",What do you think the economic situation of your family will be a few years from now? Trust in Civil service,1=None at all; 2=Not Very Much Trust; 3=Quite a Lot of Trust; 4=A Great Deal of Trust; 7=Do not understand the question; 8=Can't choose; 9=Decline to answer
q120,Trust in Government,"government effectiveness, corruption, accountability","In your opinion, is the government working to crackdown corruption and root out bribes?",0=It is doing this quite effectively; 1=It is doing its best; 2=It is doing something; 3=It is not doing much; 4=Doing nothing; 7=Do not understand the question; 8=Can't choose; 9=Decline to answer
q121,Governance and Democracy,"democratic values, personal opinion, governance",Which of the following statements comes closest to your own opinion?,"1=For people like me, it does not matter whether we have a democratic or a nondemocratic regime; 2=Under some circumstances, an authoritarian government can be peferable to a democratic one; 3=Democracy is always preferable to any other kind of government; 7=Do not understand the question; 8=Can't choose; 9=Decline to answer"
q122,Governance and Democracy,"democratic values, personal opinion, governance",Which of the following statements comes closer to your own view?,1=Democracy can not solve our society's problems; 2=Democracy is capable of solving the problems of our society; 7=Do not understand the question; 8=Can't choose; 9=Decline to answer
q123,Governance and Democracy,"democracy, economic development, trade-off","If you had to choose between democracy and economic development, which would you say is more important?",1=Economic development is definitely more important; 2=Economic development is somewhat more important; 3=Democracy is somewhat more important; 4=Democracy is definitely more important; 5=They are both equally important; 7=Do not understand the question; 8=Can't choose; 9=Decline to answer
q124,Governance and Democracy,"authoritarianism, democracy, governance","If you had to choose between democracy and economic development, which would you say is more important? We should get rid of parliament and elections and have a strong leader decide things",1=Strongly approve; 2=Approve; 3=Disapprove; 4=Strongly Disapprove; 7=Do not understand the question; 8=Can't choose; 9=Decline to answer
q125,Governance and Democracy,"authoritarianism, democracy, one-party system","If you had to choose between democracy and economic development, which would you say is more important? Only one political party is allowed to stand for election and hold office",1=Strongly approve; 2=Approve; 3=Disapprove; 4=Strongly Disapprove; 7=Do not understand the question; 8=Can't choose; 9=Decline to answer
q126,Governance and Democracy,"militarism, democracy, governance","If you had to choose between democracy and economic development, which would you say is more important? The army should come in to govern the country",1=Strongly approve; 2=Approve; 3=Disapprove; 4=Strongly Disapprove; 7=Do not understand the question; 8=Can't choose; 9=Decline to answer
