variable_id,domain,concepts,question_text,value_labels
q127,Political Values,"democracy, economic development, participation, political priority","If you had to choose between democracy and economic development, which would you say is more important? I think I have the ability to participate in politics",1=Strongly agree; 2=Somewhat agree; 3=Somewhat disagree; 4=Strongly disagree; 7=Do not understand the question; 8=Can't choose; 9=Decline to answer
q128,Political Efficacy,"political complexity, personal understanding, powerlessness",Sometimes politics and government seems so complicated that a person like me can't really understand what is going on,1=Strongly agree; 2=Somewhat agree; 3=Somewhat disagree; 4=Strongly disagree; 7=Do not understand the question; 8=Can't choose; 9=Decline to answer
q129,System Support,"government evaluation, system preference, national pride","Whatever its faults may be, our form of government is still the best for us",1=Strongly agree; 2=Somewhat agree; 3=Somewhat disagree; 4=Strongly disagree; 7=Do not understand the question; 8=Can't choose; 9=Decline to answer
q13,Economic Perception,"family economic situation, future evaluation, trust in institutions",What do you think the economic situation of your family will be a few years from now? Trust in the military(or armed forces),1=None at all; 2=Not Very Much Trust; 3=Quite a Lot of Trust; 4=A Great Deal of Trust; 7=Do not understand the question; 8=Can't choose; 9=Decline to answer
q130,Trust in Government,"government trust, institutional confidence, right decision",You can generally trust the people who run our government to do what is right (HK: Hong Kong government),1=Strongly agree; 2=Somewhat agree; 3=Somewhat disagree; 4=Strongly disagree; 7=Do not understand the question; 8=Can't choose; 9=Decline to answer
q131,Trust in Local Government,"local government trust, officials' integrity, decision-making","Generally speaking, we can trust the local government officials to do the right things",1=Strongly agree; 2=Somewhat agree; 3=Somewhat disagree; 4=Strongly disagree; 7=Do not understand the question; 8=Can't choose; 9=Decline to answer
q132,Political Ideology,"political view, ideological orientation, value preference",Which of these two statements comes closer to your own view,1=It is essential that the (country) remains one nation; 2=Part of the (country) should be allowed to become fully separate states if they choose to; 7=Do not understand the question; 8=Can't choose; 9=Decline to answer
q133,Political Equality,"educational equality, political participation, social justice",People with little or no education should have as much say in politics as highly-educated people,1=Strongly agree; 2=Somewhat agree; 3=Somewhat disagree; 4=Strongly disagree; 7=Do not understand the question; 8=Can't choose; 9=Decline to answer
q134,Political Authority,"government leadership, decision-making authority, obedience",Government leaders are like the head of a family; we should all follow their decisions,1=Strongly agree; 2=Somewhat agree; 3=Somewhat disagree; 4=Strongly disagree; 7=Do not understand the question; 8=Can't choose; 9=Decline to answer
q135,Freedom of Expression,"government control, idea discussion, censorship",The government should decide whether certain ideas should be allowed to be discussed in society,1=Strongly agree; 2=Somewhat agree; 3=Somewhat disagree; 4=Strongly disagree; 7=Do not understand the question; 8=Can't choose; 9=Decline to answer
q136,Social Cohesion,"community harmony, social organization, group formation",Harmony of the community will be disrupted if people organize lots of groups,1=Strongly agree; 2=Somewhat agree; 3=Somewhat disagree; 4=Strongly disagree; 7=Do not understand the question; 8=Can't choose; 9=Decline to answer
q137,Trust in Government,"judicial independence, executive influence, decision-making","When judges decide important cases, they should accept the view of the executive branch",1=Strongly agree; 2=Somewhat agree; 3=Somewhat disagree; 4=Strongly disagree; 7=Do not understand the question; 8=Can't choose; 9=Decline to answer
q138,Government Effectiveness,"legislative oversight, government capability, policy implementation","If the government is constantly checked by the legislature, it cannot possibly accomplish great things",1=Strongly agree; 2=Somewhat agree; 3=Somewhat disagree; 4=Strongly disagree; 7=Do not understand the question; 8=Can't choose; 9=Decline to answer
q139,Political Leadership,"moral leadership, decision-making authority, trust in leaders","If we have political leaders who are morally upright, we can let them decide everything",1=Strongly agree; 2=Somewhat agree; 3=Somewhat disagree; 4=Strongly disagree; 7=Do not understand the question; 8=Can't choose; 9=Decline to answer
q14,Economic Perception,"economic forecast, family well-being, future evaluation",What do you think the economic situation of your family will be a few years from now? Trust in the police,1=None at all; 2=Not Very Much Trust; 3=Quite a Lot of Trust; 4=A Great Deal of Trust; 7=Do not understand the question; 8=Can't choose; 9=Decline to answer
q140,Social Order,"social diversity, chaos, social cohesion","If people have too many different ways of thinking, society will be chaotic",1=Strongly agree; 2=Somewhat agree; 3=Somewhat disagree; 4=Strongly disagree; 7=Do not understand the question; 8=Can't choose; 9=Decline to answer
q141,Rule of Law,"government authority, legal constraints, crisis management","When the country is facing a difficult situation, it is ok for the government to disregard the law in order to deal with the situation",1=Strongly agree; 2=Somewhat agree; 3=Somewhat disagree; 4=Strongly disagree; 7=Do not understand the question; 8=Can't choose; 9=Decline to answer
q142,Economic Policy,"state ownership, enterprise management, economic control",The government should maintain ownership of major state-owned enterprises,1=Strongly agree; 2=Somewhat agree; 3=Somewhat disagree; 4=Strongly disagree; 7=Do not understand the question; 8=Can't choose; 9=Decline to answer
q143,Decentralization,"local autonomy, decision-making authority, regional governance",The local government should have more authority over local decisions than it does now,1=Strongly agree; 2=Somewhat agree; 3=Somewhat disagree; 4=Strongly disagree; 7=Do not understand the question; 8=Can't choose; 9=Decline to answer
q144,National Identity,"cultural preservation, national sovereignty, globalization",Our country should defend our way of life instead of becoming more and more like other countries,1=Strongly agree; 2=Somewhat agree; 3=Somewhat disagree; 4=Strongly disagree; 7=Do not understand the question; 8=Can't choose; 9=Decline to answer
q145,Social Justice,"social justice, government responsibility, income inequality","In order to preserve social justice, the government should prevent the gap between rich and poor from growing any larger",1=Strongly agree; 2=Somewhat agree; 3=Somewhat disagree; 4=Strongly disagree; 7=Do not understand the question; 8=Can't choose; 9=Decline to answer
q146,Economic Policy,"self-sufficiency, trade policy, national autonomy",Our country should become more self-sufficient and less reliant on trade with other countries,1=Strongly agree; 2=Somewhat agree; 3=Somewhat disagree; 4=Strongly disagree; 7=Do not understand the question; 8=Can't choose; 9=Decline to answer
q147,National Identity,"national identity, attachment, citizenship",Let us suppose that you had to choose between being a..... which of these do you feel most strongly attached to,"1=R""s Citizenship; 2=R""s ethnic/regional group; 3=R""S another identity; 7=Do not understand the question; 8=Can't choose; 9=Decline to answer"
q148,Civil Rights,"equal rights, citizenship, social freedom",These people should have the equal right to do whatever they want to do as other citizens,1=Strongly agree; 2=Somewhat agree; 3=Somewhat disagree; 4=Strongly disagree; 5=Not agree nor disagree; 7=Do not understand the question; 8=Can't choose; 9=Decline to answer
q149,Voting Rights,"voting rights, electoral participation, citizenship",They should enjoy the same right as other citizens to vote in the election of the top leader,1=Strongly agree; 2=Somewhat agree; 3=Somewhat disagree; 4=Strongly disagree; 5=Not agree nor disagree; 7=Do not understand the question; 8=Can't choose; 9=Decline to answer
q15,Economic Perception,"economic prospects, family well-being, future evaluation",What do you think the economic situation of your family will be a few years from now? Trust in local government,1=None at all; 2=Not Very Much Trust; 3=Quite a Lot of Trust; 4=A Great Deal of Trust; 7=Do not understand the question; 8=Can't choose; 9=Decline to answer
q150,Social Welfare,"social welfare, government responsibility, basic needs",Their basic well-being should be taken care of by the government to the same extent as other citizens,1=Strongly agree; 2=Somewhat agree; 3=Somewhat disagree; 4=Strongly disagree; 5=Not agree nor disagree; 7=Do not understand the question; 8=Can't choose; 9=Decline to answer
q151,Civic Duty,"civic duty, community participation, citizenship responsibilities",A citizen who does not actively participate in the affairs of his local and national community is not performing his duties,1=Strongly agree; 2=Somewhat agree; 3=Somewhat disagree; 4=Strongly disagree; 5=Not agree nor disagree; 7=Do not understand the question; 8=Can't choose; 9=Decline to answer
q152,Law and Order,"law obedience, citizen compliance, regulatory adherence","Citizens should always obey laws and regulations, even if they disagree with them",1=Strongly agree; 2=Somewhat agree; 3=Somewhat disagree; 4=Strongly disagree; 5=Not agree nor disagree; 7=Do not understand the question; 8=Can't choose; 9=Decline to answer
q153,National Loyalty,"national loyalty, citizen allegiance, country devotion","Do you agree or disagree with the following statement: ""A citizen should always remain loyal only to his country, no matter how imperfect",1=Strongly agree; 2=Somewhat agree; 3=Somewhat disagree; 4=Strongly disagree; 5=Not agree nor disagree; 7=Do not understand the question; 8=Can't choose; 9=Decline to answer
q154,National Pride,"national identity, pride, citizenship",How proud are you to be a citizen of [Country],1=Very proud; 2=Somewhat proud; 3=Not very proud; 4=Not proud at all; 7=Do not understand the question; 8=Can't choose; 9=Decline to answer
q155,Migration Intentions,"migration, willingness, international movement","Given the chance, how willing would you be to go and live in another country?",1=Very willing; 2=Willing; 3=Not willing; 4=Not willing at all; 7=Do not understand the question; 8=Can't choose; 9=Decline to answer
q156,International Organizations,"European Community, European Union, international relations",Relation: The European Community or European Union,1=Yes; 2=No; 9=Decline to answer
q157,International Organizations,"United Nations, UN, global governance",Relation: The United Nations or UN,1=Yes; 2=No; 9=Decline to answer
q158,International Organizations,"International Monetary Fund, IMF, global economy",Relation: International Monetary Fund or IMF,1=Yes; 2=No; 9=Decline to answer
q159,International Organizations,"World Bank, global development, international finance",Relation: World Bank,1=Yes; 2=No; 9=Decline to answer
q16,Economic Perception,"family economic situation, future evaluation, temporal comparison",What do you think the economic situation of your family will be a few years from now? Trust in newspaper,1=None at all; 2=Not Very Much Trust; 3=Quite a Lot of Trust; 4=A Great Deal of Trust; 7=Do not understand the question; 8=Can't choose; 9=Decline to answer
q160,International Organizations,"European Community, European Union, impression, evaluation",Impression: The European Community or European Union,1=Very Bad; 2=...; 2=...; 2=...; 2=...; 2=...; 2=...; 2=...; 2=...; 10=Very Good; 90=Not applicable; 97=Do not understand the question; 98=Can't choose; 99=Decline to answer
q161,International Organizations,"United Nations, UN, impression, evaluation",Impression: The United Nations or UN,1=Very Bad; 2=...; 2=...; 2=...; 2=...; 2=...; 2=...; 2=...; 2=...; 10=Very Good; 90=Not applicable; 97=Do not understand the question; 98=Can't choose; 99=Decline to answer
q162,International Organizations,"International Monetary Fund, IMF, impression, evaluation",Impression: International Monetary Fund or IMF,1=Very Bad; 2=...; 2=...; 2=...; 2=...; 2=...; 2=...; 2=...; 2=...; 10=Very Good; 90=Not applicable; 97=Do not understand the question; 98=Can't choose; 99=Decline to answer
q163,Institutional Perception,"institutional impression, international organization, evaluation",Impression: World Bank,1=Very Bad; 2=...; 2=...; 2=...; 2=...; 2=...; 2=...; 2=...; 2=...; 10=Very Good; 90=Not applicable; 97=Do not understand the question; 98=Can't choose; 99=Decline to answer
q164,Country Perception,"country impression, foreign country, evaluation",Impression: United States,1=Very Bad; 2=...; 2=...; 2=...; 2=...; 2=...; 2=...; 2=...; 2=...; 10=Very Good; 90=Not applicable; 97=Do not understand the question; 98=Can't choose; 99=Decline to answer
q165,Country Perception,"country impression, foreign country, evaluation",Impression: China,1=Very Bad; 2=...; 2=...; 2=...; 2=...; 2=...; 2=...; 2=...; 2=...; 10=Very Good; 90=Not applicable; 97=Do not understand the question; 98=Can't choose; 99=Decline to answer
q166,Country Perception,"country impression, foreign country, evaluation",Impression: Japan,1=Very Bad; 2=...; 2=...; 2=...; 2=...; 2=...; 2=...; 2=...; 2=...; 10=Very Good; 90=Not applicable; 97=Do not understand the question; 98=Can't choose; 99=Decline to answer
q17,Economic Perception,"economic situation, family level, future evaluation, trust in media",What do you think the economic situation of your family will be a few years from now? Trust in television,1=None at all; 2=Not Very Much Trust; 3=Quite a Lot of Trust; 4=A Great Deal of Trust; 7=Do not understand the question; 8=Can't choose; 9=Decline to answer
q18,Economic Perception,"economic situation, family level, future evaluation, trust in institution",What do you think the economic situation of your family will be a few years from now? Trust in the election commission(Singapore: International TV),1=None at all; 2=Not Very Much Trust; 3=Quite a Lot of Trust; 4=A Great Deal of Trust; 7=Do not understand the question; 8=Can't choose; 9=Decline to answer
q19,Economic Perception,"economic situation, family level, future evaluation, trust in NGOs",What do you think the economic situation of your family will be a few years from now? Trust in NGOs,1=None at all; 2=Not Very Much Trust; 3=Quite a Lot of Trust; 4=A Great Deal of Trust; 7=Do not understand the question; 8=Can't choose; 9=Decline to answer
q2,Economic Perception,"economic condition, national level, temporal comparison, evaluation",How would you describe the change in the economic condition of our country over the last years?,1=Much worse; 2=A little worse; 3=About the same; 4=A little better; 5=Much better; 8=Can't choose; 9=Decline to answer
q20,Social Participation,"organizational membership, formal groups, affiliation",Are you a member of any organization or formal groups?,1=Yes; 2=No; 8=Can't choose; 9=Decline to answer
q20_1,Social Participation,"organizational membership, specific organization, identification",First organization,1=Political parties; 2=Residential & community associations; 3=Religious groups; 4=Sports/recreational clubs; 5=Culture organizations; 6=Charities; 7=Public interest groups (exc.); 8=Labor unions; 9=Farmer unions or agricultural associations; 10=Professional organizations; 11=Business association; 12=Parent-Teacher Association or PTA; 13=Producer cooperative; 14=Consumer cooperative; 15=Alumni association; 16=Candidate support organization; 17=Other occupational organizations (etc.); 18=Other volunteer organizations; 19=Hometown associations(others); 20=Clan associations(others); 90=Not a member of any organization or group; 98=Not applicable; 99=No more answer
q20_2,Social Network,"social connection, organization membership",Second organization,1=Political parties; 2=Residential & community associations; 3=Religious groups; 4=Sports/recreational clubs; 5=Culture organizations; 6=Charities; 7=Public interest groups (exc.); 8=Labor unions; 9=Farmer unions or agricultural associations; 10=Professional organizations; 11=Business association; 12=Parent-Teacher Association or PTA; 13=Producer cooperative; 14=Consumer cooperative; 15=Alumni association; 16=Candidate support organization; 17=Other occupational organizations (etc.); 18=Other volunteer organizations; 19=Hometown associations(others); 20=Clan associations(others); 90=Not a member of any organization or group; 98=Not applicable; 99=No more answer
q20_3,Social Network,"social connection, organization membership",Third organization,1=Political parties; 2=Residential & community associations; 3=Religious groups; 4=Sports/recreational clubs; 5=Culture organizations; 6=Charities; 7=Public interest groups (exc.); 8=Labor unions; 9=Farmer unions or agricultural associations; 10=Professional organizations; 11=Business association; 12=Parent-Teacher Association or PTA; 13=Producer cooperative; 14=Consumer cooperative; 15=Alumni association; 16=Candidate support organization; 17=Other occupational organizations (etc.); 18=Other volunteer organizations; 19=Hometown associations(others); 20=Clan associations(others); 90=Not a member of any organization or group; 98=Not applicable; 99=No more answer
q23,Trust in Others,"trust, generalized trust, social cohesion","General speaking, would you say ""Most people can be trusted"" or ""that you must be very careful""?",1=You must be very careful in dealing with people; 2=Most people can be trusted; 7=Do not understand the question; 8=Can't choose; 9=Decline to answer
q24,Trust in Others,"trust, relatives, family ties",How much trust do you have in your relatives?,1=None at all; 2=Not Very Much Trust; 3=Quite a Lot of Trust; 4=A Great Deal of Trust; 7=Do not understand the question; 8=Can't choose; 9=Decline to answer
q25,Trust in Others,"trust, neighbors, community relationships",How much trust do you have in your neighbors?,1=None at all; 2=Not Very Much Trust; 3=Quite a Lot of Trust; 4=A Great Deal of Trust; 7=Do not understand the question; 8=Can't choose; 9=Decline to answer
q26,Trust in Others,"trust, social interactions, acquaintances",How much trust do you have in other people you interact with?,1=None at all; 2=Not Very Much Trust; 3=Quite a Lot of Trust; 4=A Great Deal of Trust; 7=Do not understand the question; 8=Can't choose; 9=Decline to answer
q27,Social Interaction,"social contact, daily interactions, social network size","On average, about how many people do you have contact with in a typical week day?",0=Not applicable; 1=0-4 people; 2=5-9 people; 3=10-19 people; 4=20-49 people; 5=50 or more people; 8=Can't choose; 9=Decline to answer
q28,Social Influence,"social influence, helping others, reciprocity",How often are you asked to help influence important decisions in other people's favor?,1=Never; 2=Seldom; 3=Occasionally; 4=Often; 7=Do not understand the question; 8=Can't choose; 9=Decline to answer
q29,Social Support,"social support, help-seeking, reciprocity",And are there people you could ask to help influence important decisions in your favor?,"1=No, nobody; 2=Yes, a few; 3=Yes, some; 4=Yes, a lot; 7=Do not understand the question; 8=Can't choose; 9=Decline to answer"
q3,Economic Perception,"economic condition, national level, future evaluation",What do you think will be the state of our country's economic condition a few years from now?,1=Much worse; 2=A little worse; 3=About the same; 4=A little better; 5=Much better; 8=Can't choose; 9=Decline to answer
q30,Social Reciprocity,"reciprocal help, social support, future expectation","Do you agree or disagree with the following statement: By helping people in trouble today, someone else will help me when I am in trouble someday.",1=Agree; 2=Somewhat agree; 3=Somewhat disagree; 4=Disagree; 5=Neither agree nor disagree; 7=Do not understand the question; 8=Can't choose; 9=Decline to answer
q31,Social Interaction,"political discussion, social discomfort, opinion difference",Would you have a hard time conversing with your friends or co-workers about politics if you had differing opinions?,1=Very hard; 2=A bit hard; 3=Not too hard; 4=Not hard at all; 7=Do not understand the question; 8=Can't choose; 9=Don't respond
q32,Perceived Safety,"urban safety, current evaluation, personal security","Generally speaking, how safe is living in this city/town/village?",1=Very safe; 2=Safe; 3=Unsafe; 4=Very unsafe; 8=Can't choose; 9=Decline to answer
q33,Perceived Safety,"safety comparison, temporal change, urban security","Compared to the situation in this city/town/village a few years ago, do you feel more safe, less safe or the same as before?",0=Not applicable; 1=More safe; 2=Less safe; 3=Same as before; 8=Can't choose; 9=Decline to answer
q34,Victimization,"property crime, personal experience, vehicle theft","Have you been a victim of car, motorcycle or bicycle theft?",0=Do not own any kind of vehicle; 1=No; 2=Yes; 8=Can't choose; 9=Decline to answer
q35,Victimization,"property crime, personal experience, theft",Have you been a victim of pick-pocketing/robbery of personal property?,0=Not applicable; 1=No; 2=Yes; 8=Can't choose; 9=Decline to answer
q36,Victimization,"property crime, personal experience, home break-in",Have you been a victim of break-in at your home?,0=Not applicable; 1=No; 2=Yes; 8=Can't choose; 9=Decline to answer
q37,Victimization,"violent crime, personal experience, physical harm",Have you been a victim of physical violence?,0=Not applicable; 1=No; 2=Yes; 8=Can't choose; 9=Decline to answer
q38,Political Participation,"voting behavior, electoral participation, civic engagement",Have you voted in the last election?,0=Not applicable; 1=No; 2=Yes; 8=Can't choose; 9=Decline to answer
q39,Political Preference,"party affiliation, voting choice, political allegiance",Which parties (or candidates for president if it was presidential race) did you vote for?,"90=Not applicable; 94=Secret; 95=No answer; 96=Forgot; 97=Do not know; 98=Cannot choose; 99=Decline to answer; 101=LDP; 102=DPJ; 103=Komeito(CGP); 104=SDP; 105=JCP; 106=other party; 107=Independent; 110=no information; 111=voted in blank; 301=The Uri Party(governing party); 302=The Grand National Party; 303=The Democratic Party; 304=The United Liberal Democrats; 305=The Democratic Labor Party; 306=Other Parties; 107=Independent; 501=N. Enhbayar; 502=M. Enhsaikhan; 503=B. Jargalsaikhan; 504=B. Erdenebat; 601=LACSON, PANFILO; 602=MACAPAGAL-ARROYO, GLORIA; 603=POE, FERNANDO JR.; 604=ROCO, RAUL; 605=VILLANUEVA, EDUARDO; 701=Shui-bian Chen and Annette Lu; 702=Chan Lien and James Soong; 801=THAI RAK THAI; 802=Other Party; 803=Vote for no vote; 804=Non-valid vote; 901=Indonesian National Party Marhaenism; 902=Social Democrat Labour Party; 903=Crescent Star Party; 904=Independent Party; 905=United Development Party; 906=United Democratic Nationhood Party; 907=New Indonesia Union Party; 908=Freedom Bull National Party; 909=Democrat Party; 910=Justice and Unity Party; 911=Indonesian Democratic Vanguard Party; 912=Indonesian United Renaissance People Party; 913=National Mandate Party; 914=Concern for thel Nation Functional Party; 915=National Awakening Party; 916=Prosperous and Justice Party; 917=Reform Star Party; 918=Indonesian Democratic Party-Struggle; 919=Peace and Prosperous Party; 920=Functional Group Party; 921=Patriot Pancasila Party; 922=Indonesian Association Party; 923=United Regional Party; 924=Vanguard Party; 1301=BarisanNasional; 1302=UMNO; 1303=MCA; 1304=MIC; 1305=Gerakan; 1306=PBS; 1307=PBB; 1308=SUPP; 1309=Other BN party; 1310=Opposition; 1311=PAS; 1312=DAP; 1313=PKR; 1314=Other"
q39a,Voting Behavior,"voting decision, election outcome, candidate support",If the respondent voted for the winning camp or loosing camp?,0=Not applicable; 1=Voted for the winning camp(governing party); 2=Voted for the losing camp(opposition party); 9=Decline to answer
q4,Economic Perception,"economic situation, family level, current evaluation","As for your own family, how do you rate your economic situation today?",1=Very bad; 2=Bad; 3=So so (not good nor bad); 4=Good; 5=Very good; 8=Can't choose; 9=Decline to answer
q40,Political Participation,"campaign engagement, political rally, attendance",Attend a campaign meeting or rally,0=Not applicable; 1=No; 2=Yes; 8=Can't choose; 9=Decline to answer
q41,Political Participation,"persuasion, voting influence, candidate support",Try to persuade others to vote for a certain candidate or party,0=Not applicable; 1=No; 2=Yes; 8=Can't choose; 9=Decline to answer
q42,Political Participation,"volunteering, party support, election assistance",Did you do anything else to help out or work for a party or candidate running in the election,0=Not applicable; 1=No; 2=Yes; 8=Can't choose; 9=Decline to answer
q43,Election Perception,"election evaluation, freeness, fairness","On the whole, how would you rate the freeness and fairness of the last national election?","0=Not applicable; 1=Completely free and fair; 2=Free and fair, but with minor problems; 3=Free and fair, with major problems; 4=Not free or fair; 8=Can't choose; 9=Decline to answer"
q44,Service Accessibility,"identity document, obtainment ease, administrative service","On the whole, how would you rate the freeness and fairness of the last national election? How easy is it to obtain: An identity document",0=Not applicable; 1=Very Difficult; 2=Difficult; 3=Easy; 4=Very Easy; 5=Never Try; 8=Can't choose; 9=Decline to answer
