variable_id,domain,concepts,question_text,validation_phrase,validation_phrase_occurrences,validation_phrase_score
q19,Trust in Institutions,"institutional trust, evaluation","I'm going to name a number of institutions. For each one, please tell me how much trust do you have in them? Non-governmental organizations or NGOs <Optional>",you have in them? non-governmental,1,132.0
q2,Economic Perception,"economic condition, national level, current evaluation",q2. How would you describe the change in the economic condition of our country over the last few years,q2. how would you describe,1,132.0
q20,Social Networks/Community Involvement,"social organization, membership",q20. Could you identity the three most important organizations or formal groups you belong to. First Organization,could you identity the three,1,132.0
q21,Trust in Institutions,"trust, organization",q21. Second Organization,q21. second organization,1,132.0
q22,Trust in Institutions,"trust, organization",q22. Third Organization,q22. third organization,1,132.0
q23,Trust in People,"trustworthiness, general population","q23. General speaking, would you say that ""Most people can be trusted"" or ""that you must be very careful in dealing with people""?","q23. general speaking, would you",1,132.0
q24,Trust in People,"trustworthiness, general population","q24. Do you think most people would try to take advantage of you if they got a chance, or would they try to be fair? (NEW)",think most people would try,1,132.0
q25,Trust in Specific Groups,"trust, relatives",q25. How much trust do you have in each of the following types of people?   Your relatives,q25. how much trust do,1,132.0
q26,Trust in Specific Groups,"trust, neighbors",How much trust do you have in each of the following types of people? Your neighbors,types of people? your neighbors,1,132.0
q27,Trust in Specific Groups,"trust, people you interact with",How much trust do you have in each of the following types of people? Other people you interact with,following types of people? other,1,132.0
q28,Social Network,"social connections, frequency of contact","q28. On average, about how many people do you have contact with in a typical week day?  We are interested in contact on a one-on-one basis, including everyone with whom you chat, talk, or discuss matters.  This can be face to face, by telephone, by mail,","q28. on average, about how",1,132.0
q29,Social Support,"help seeking, social support","q29. If you have a difficult problem to manage, are there people outside your household you can ask for help? (NEW)",can ask for help? (new),1,132.0
q3,Economic Perception,"economic condition, national level, current evaluation, future evaluation",How would you describe the change in the economic condition of our country over the last few years What do you think will be the state of our country's economic condition a few years from now? Will it be …,last few years what do,1,132.0
q30,Social Support,"social support, help seeking, reciprocity","If you have a difficult problem to manage, are there people outside your household you can ask for help? When people outside your household have problems, do they come to you for help? (NEW)",ask for help? when people,1,132.0
q31,Social Interaction,"social interaction, conflict, politics","q31. If you had friends or co-workers whose opinions on politics differed from yours, would you have a hard time conversing with them? (NEW)",q31. if you had friends,1,132.0
q32,Voting Behavior,"voting behavior, barriers to voting, election participation","q32. In talking to people about elections, we often find that a lot of people were not able to vote because they were away from home, they were sick or they just didn't have time. How about you? Did you vote in the election [the most recent national elect",q32. in talking to people,1,132.0
q33,Voting Behavior,"voting behavior, party affiliation, candidate preference",q33. Which parties (or candidates for president if it was presidential race) did you vote for? [country-specific response grid],q33. which parties (or candidates,1,132.0
q33a,Voting Behavior,"voting behavior, winning/losing camp, election outcome","q33a. Based on the answer to Q33, please construct a new variable indicating if the respondent voted for the winning camp or losing camp.",q33a. based on the answer,1,132.0
q34,Campaign Participation,"campaign participation, election engagement, rally attendance","q34. Thinking about the national election in [year], did you attend a campaign meeting or rally?",q34. thinking about the national,1,132.0
q35,Campaign Participation,"campaign participation, election engagement, persuasion","Thinking about the national election in [year], did you attend a campaign meeting or rally? try to persuade others to vote for a certain candidate or party?",campaign meeting or rally? try,1,132.0
q36,Campaign Participation,"campaign participation, election engagement, volunteering","Thinking about the national election in [year], did you attend a campaign meeting or rally? Did you do anything else to help out or work for a party or candidate running in the election?",campaign meeting or rally? did,1,132.0
q37,Election Integrity,"election integrity, freedom and fairness, election quality","q37. On the whole, how free and fair would you say the last national election was? (NEW)","q37. on the whole, how",1,132.0
q38,Service Accessibility,"service accessibility, government services, identity documents","q38. Based on your experience, how easy or difficult is it to obtain the following services?  Or have you never tried to get these services from government?  An identity document (such as a birth certificate or passport)","q38. based on your experience,",1,132.0
q39,Service Accessibility,"service accessibility, public primary school, temporal comparison","Based on your experience, how easy or difficult is it to obtain the following services? A place in a public primary school for a child",place in a public primary,1,132.0
q4,Economic Perception,"economic condition, evaluation, temporal comparison","q4. As for your own family, how do you rate the economic situation of your family today?  Is it …",q4. as for your own,1,132.0
q40,Service Accessibility,"service accessibility, medical treatment, spatial proximity","Based on your experience, how easy or difficult is it to obtain the following services? Medical treatment at a nearby clinic",obtain the following services? medical,1,132.0
q41,Service Accessibility,"service accessibility, police assistance, spatial proximity","Based on your experience, how easy or difficult is it to obtain the following services? Help from the police when you need it",obtain the following services? help,1,132.0
q42,Safety Perception,"safety, spatial level, evaluation","q42. Generally speaking, how safe is living in this city/ town/ village - very safe, safe, unsafe or very unsafe?","q42. generally speaking, how safe",1,132.0
q43,Political Engagement,"political interest, evaluation",q43. How interested would you say you are in politics?,q43. how interested would you,1,132.0
q44,Information Seeking,"news consumption, government information, frequency",q44. How often do you follow news about politics and government?,q44. how often do you,1,132.0
q45,Digital Literacy,"internet usage, frequency",q45. How often do you use the internet?,q45. how often do you,1,132.0
q46,Political Engagement,"political discussion, frequency","q46. When you get together with your family members or friends, how often do you discuss political matters?",q46. when you get together,1,132.0
q47,Party Affiliation,"party preference, evaluation","q47. Among the political parties listed here, which party if any do you feel closest to?",q47. among the political parties,1,132.0
q48,Social Relationships,"social proximity, evaluation, temporal comparison","q48. How close do you feel to (answer in Q47)? Is it very close, somewhat close, or just a little close?",q48. how close do you,1,132.0
q49,Trust in Institutions,"trustworthiness, evaluation, attitude","q49. Please tell me how you feel about the following statements. Would you say you strongly agree, somewhat agree, somewhat disagree, or strongly disagree? Most people are trustworthy?",q49. please tell me how,1,132.0
q5,Economic Perception,"economic condition, national level, current evaluation, temporal comparison",q5. How would you compare the current economic condition of your family with what it was a few years ago? Is it …,q5. how would you compare,1,132.0
q50,Social Norms and Values,"family interest, personal interest, evaluation, attitude","Please tell me how you feel about the following statements. Would you say you strongly agree, somewhat agree, somewhat disagree, or strongly disagree? For the sake of the family, the individual should put his personal interests second",strongly disagree? for the sake,1,132.0
q51,Social Norms and Values,"group interest, individual interest, evaluation, attitude","q51. In a group, we should sacrifice our individual interest for the sake of the group's collective interest.","q51. in a group, we",1,132.0
q52,National Interest,"national interest, individual interest, evaluation, attitude","q52. For the sake of national interest, individual interest could be sacrificed.",q52. for the sake,1,132.0
q53,Interpersonal Relationships,"long-term relationship, immediate interest, evaluation, attitude","For the sake of national interest, individual interest could be sacrificed. When dealing with others, developing a long-term relationship is more important than securing one's immediate interest.","when dealing with others, developing",1,132.0
q54,Interpersonal Relationships,"long-term relationship, immediate interest, planning, evaluation, attitude","For the sake of national interest, individual interest could be sacrificed. When dealing with others, one should not only focus on immediate interest but also plan for future.","others, one should not only",1,132.0
q55,Family Dynamics,"parental authority, individual interest, evaluation, attitude","For the sake of national interest, individual interest could be sacrificed. Even if parents' demands are unreasonable, children still should do what they ask.",be sacrificed. even if parents',1,132.0
q56,Family Dynamics,"marital relationships, parental authority, individual interest, evaluation, attitude","For the sake of national interest, individual interest could be sacrificed. When a mother-in-law and a daughter-in-law come into conflict, even if the mother-in-law is in the wrong, the husband should still persuade his wife to obey his mother.",be sacrificed. when a mother-in-law,1,132.0
q57,Social Norms and Values,"sacrifice, authority, national interest","For the sake of national interest, individual interest could be sacrificed. Being a student, one should not question the authority of their teacher.",interest could be sacrificed. being,1,132.0
q58,Social Norms and Values,"harmony, group dynamics, national interest","For the sake of national interest, individual interest could be sacrificed. In a group, we should avoid open quarrel to preserve the harmony of the group","be sacrificed. in a group,",1,132.0
q59,Social Norms and Values,"conflict avoidance, disagreement, national interest","For the sake of national interest, individual interest could be sacrificed. Even if there is some disagreement with others, one should avoid the conflict","is some disagreement with others,",1,132.0
q6,Economic Perception,"economic situation, family, temporal comparison",q6. What do you think the economic situation of your family will be a few years from now? Will it be …,you think the economic situation,1,132.0
q60,Social Norms and Values,"opinion formation, co-worker agreement, national interest","For the sake of national interest, individual interest could be sacrificed. A person should not insist on his own opinion if his co-workers disagree with him",could be sacrificed. a person,1,132.0
q61,Social Norms and Values,"fate determination, wealth and poverty, national interest","For the sake of national interest, individual interest could be sacrificed. Wealth and poverty, success and failure are all determined by fate.",interest could be sacrificed. wealth,1,132.0
q62,Social Norms and Values,"child preference, gender preference, national interest","For the sake of national interest, individual interest could be sacrificed. If one could have only one child, it is more preferable to have a boy than a girl.",interest could be sacrificed. if,1,132.0
q63,Social Norms and Values,"short-term vs long-term thinking, national interest","For the sake of national interest, individual interest could be sacrificed. When dealing with others, one should not be preoccupied with temporary gains and losses.","others, one should not be",1,132.0
q64,Government Accountability,"citizen-government interaction, problem-solving, official contact","q64. In the past three (3) years, have you never, once, or more than once done the following because of personal, family, or neighborhood problems, or problems with government officials and policies?Contacted elected officials or legislative representativ",q64. in the past three,1,132.0
q65,Government Accountability,"citizen-government interaction, problem-solving, official contact","In the past three (3) years, have you never, once, or more than once done the following because of personal, family, or neighborhood problems, or problems with government officials and policies?Contacted elected officials or legislative representativ Contacted officials at higher level.",or legislative representativ contacted officials,1,132.0
q66,Citizen Engagement,"citizen participation, government responsiveness, community involvement","In the past three (3) years, have you never, once, or more than once done the following because of personal, family, or neighborhood problems, or problems with government officials and policies?Contacted elected officials or legislative representativ Contacted traditional leaders/community leaders.",or legislative representativ contacted traditional,1,132.0
q67,Citizen Engagement,"citizen participation, government responsiveness, community involvement","In the past three (3) years, have you never, once, or more than once done the following because of personal, family, or neighborhood problems, or problems with government officials and policies?Contacted elected officials or legislative representativ Contacted other influential people outside the government",or legislative representativ contacted other,1,132.0
q68,Citizen Engagement,"citizen participation, government responsiveness, media influence","In the past three (3) years, have you never, once, or more than once done the following because of personal, family, or neighborhood problems, or problems with government officials and policies?Contacted elected officials or legislative representativ Contacted news media",or legislative representativ contacted news,1,132.0
q69,Citizen Engagement,"citizen participation, community organization, social mobilization","In the past three (3) years, have you never, once, or more than once done the following because of personal, family, or neighborhood problems, or problems with government officials and policies?Contacted elected officials or legislative representativ Here is a list of actions that people sometimes take as citizens. For each of these, please tell me whether you, personally, have never, once, or more than once done any of these things during the past three years.   Got together with others to try t",officials or legislative representativ here,1,132.0
q7,Trust in Institutions,"institutional trust, presidential trust","q7. I'm going to name a number of institutions. For each one, please tell me how much trust do you have in them? The president",q7. i'm going to name,1,132.0
q70,Citizen Engagement,"citizen participation, community organization, social mobilization","In the past three (3) years, have you never, once, or more than once done the following because of personal, family, or neighborhood problems, or problems with government officials and policies?Contacted elected officials or legislative representativ Got together with others to raise an issue or sign a petition",officials or legislative representativ got,1,132.0
q71,Citizen Engagement,"citizen participation, protest behavior, social mobilization","In the past three (3) years, have you never, once, or more than once done the following because of personal, family, or neighborhood problems, or problems with government officials and policies?Contacted elected officials or legislative representativ Attended a demonstration or protest march",officials or legislative representativ attended,1,132.0
q72,Citizen Engagement,"citizen participation, violent protest, social mobilization","In the past three (3) years, have you never, once, or more than once done the following because of personal, family, or neighborhood problems, or problems with government officials and policies?Contacted elected officials or legislative representativ Used force or violence for a political cause",officials or legislative representativ used,1,132.0
q73,Voting Behavior,"voting frequency, electoral participation","q73. Thinking of whether you voted or not ever since you became eligible for voting, how would you describe yourself -have you voted in every election, voted in most elections, voted in some elections or hardly ever voted?",q73. thinking of whether you,1,132.0
q74,Government Preference,"government preference, democratic values","q74. Let's talk for a moment about the kind of government you would like to have in this country, which of the followings statements do you agree with most? Choose the first or the second statement. [Interviewer: Probe whether respondent strongly agrees o",q74. let's talk,1,132.0
q74a,Trust in Government,"evaluation, agreement",q74a. Do you strongly agree or just agree with the chosen statement?,q74a. do you strongly agree,1,132.0
q75,Trust in Government,"government preference, national level","q75. Let's talk for a moment about the kind of government you would like to have in this country, which of the followings statements do you agree with most? Choose the first or the second statement. [Interviewer: Probe whether respondent strongly agrees o",q75. let's talk,1,132.0
q75a,Trust in Government,"evaluation, agreement",q75a. Do you strongly agree or just agree with the chosen statement?,q75a. do you strongly agree,1,132.0
q76,Trust in Government,"government preference, national level","q76. Let's talk for a moment about the kind of government you would like to have in this country, which of the followings statements do you agree with most? Choose the first or the second statement. [Interviewer: Probe whether respondent strongly agrees o",q76. let's talk,1,132.0
q76a,Trust in Government,"evaluation, agreement",q76a. Do you strongly agree or just agree with the chosen statement?,q76a. do you strongly agree,1,132.0
q77,Trust in Government,"government preference, national level","q77. Let's talk for a moment about the kind of government you would like to have in this country, which of the followings statements do you agree with most? Choose the first or the second statement. [Interviewer: Probe whether respondent strongly agrees o",q77. let's talk,1,132.0
q77a,Trust in Government,"evaluation, agreement",q77a. Do you strongly agree or just agree with the chosen statement?,q77a. do you strongly agree,1,132.0
q78,Trust in Government,"government preference, national level","q78. Let's talk for a moment about the kind of government you would like to have in this country, which of the followings statements do you agree with most? Choose the first or the second statement. [Interviewer: Probe whether respondent strongly agrees o",q78. let's talk,1,132.0
q78a,Trust in Government,"evaluation, agreement",q78a. Do you strongly agree or just agree with the chosen statement?,q78a. do you strongly agree,1,132.0
q79,Trust in Government,"government preference, national level","q79. Let's talk for a moment about the kind of government you would like to have in this country, which of the followings statements do you agree with most? Choose the first or the second statement. [Interviewer: Probe whether respondent strongly agrees o",q79. let's talk,1,132.0
q79a,Trust in Institutions,"evaluation, agreement",q79a. Do you strongly agree or just agree with the chosen statement?,q79a. do you strongly agree,1,132.0
q8,Trust in Institutions,"trust, institutional evaluation","I'm going to name a number of institutions. For each one, please tell me how much trust do you have in them? The courts",have in them? the courts,1,132.0
q80,System of Government,"government capability, problem-solving, temporal comparison","q80. Over the long run, our system of government is capable of solving the problems our country faces.","q80. over the long run,",1,132.0
q81,System of Government,"government capability, problem-solving, patriotism, temporal comparison","Over the long run, our system of government is capable of solving the problems our country faces. Thinking in general, I am proud of our system of government.",problems our country faces. thinking,1,132.0
q82,System of Government,"government capability, problem-solving, support, temporal comparison","Over the long run, our system of government is capable of solving the problems our country faces. A system like ours, even if it runs into problems, deserves the people's support.",our country faces. a system,1,132.0
q83,System of Government,"government preference, system evaluation, temporal comparison","Over the long run, our system of government is capable of solving the problems our country faces. I would rather live under our system of government than any other that I can think of.",problems our country faces. i,1,132.0
q84,System of Government,"system evaluation, system comparison, change preference","q84. Compared with other systems in the world, would you say our system of government works fine as it is, needs minor change, needs major change, or should be replaced?",q84. compared with other systems,1,132.0
q85,Democracy Characteristics,"democracy definition, essential characteristics, choice","q85. Many things may be desirable, but not all of them are essential characteristics of democracy. If you have to choose only one from each four sets of statements that I am going to read, which one would you choose as the most essential characteristics o",q85. many things may be,1,132.0
q86,Democracy Characteristics,"democracy definition, essential characteristics, choice","q86. If you have to choose only one from each four sets of statements that I am going to read, which one would you choose as the most essential characteristics of a democracy?",q86. if you,1,132.0
q87,Democracy Characteristics,"democracy definition, essential characteristics, choice","q87. If you have to choose only one from each four sets of statements that I am going to read, which one would you choose as the most essential characteristics of a democracy?",q87. if you,1,132.0
q88,Democracy Perception,"democracy, characteristics, essential","q88. If you have to choose only one from each four sets of statements that I am going to read, which one would you choose as the most essential characteristics of a democracy?",q88. if you,1,132.0
q89,Democracy Perception,"democracy, evaluation, satisfaction","q89. On the whole, how satisfied or dissatisfied are you with the way democracy works in [Country].  Are you …?","q89. on the whole, how",1,132.0
q9,Trust in Institutions,"trust, institutions, national government","I'm going to name a number of institutions. For each one, please tell me how much trust do you have in them? The national government [in capital city]",have in them? the national,1,132.0
q90,Democracy Perception,"democracy, evaluation, country level",q90. In your opinion how much of a democracy is [Country Name] ?,q90. in your opinion how,1,132.0
q91,Democracy Perception,"democracy, evaluation, country level, present government",q91. Here is a scale: 1 means completely undemocratic and 10 means completely democratic. Where would you place our country under the present government?,q91. here is a scale:,1,132.0
q92,Democracy Perception,"democracy, evaluation, country level, temporal comparison",Here is a scale: 1 means completely undemocratic and 10 means completely democratic. Where would you place our country ten years ago?,you place our country ten,1,132.0
q93,Democracy Perception,"democracy, evaluation, country level, future aspiration",Here is a scale: 1 means completely undemocratic and 10 means completely democratic. Where would you want our country to be in the future?,would you want our country,1,132.0
q94,Democracy Perception,"democracy, evaluation, country level, suitability","Here is a scale: 1 means completely undemocratic and 10 means completely democratic. Here is a similar scale of 1 to 10 measuring the extent to which people think democracy is suitable for our country. If ""1"" means that democracy is completely unsuitable for [name of country] today and ""10"" means that it is completely suitable, where",10 means completely democratic. here,1,132.0
q95,Government Satisfaction,"government, evaluation, satisfaction","q95. How satisfied or dissatisfied are you with the [name of president, etc. ruling current] government?  Are you …?",q95. how satisfied or dissatisfied,1,132.0
q96,Problem Identification,"problems, government responsibility","q96. In your opinion, what are the most important problems facing this country that government should address?","q96. in your opinion, what",1,132.0
