variable_id,domain,concepts,question_text,validation_phrase,validation_phrase_occurrences,validation_phrase_score
allweight,Unknown,,"individual country weight 

Variable: couweight 
  Question: cross-country weight 

Variable: q129a 
  Question: strong leader",individual country weight variable: couweight,1,132.0
country,Unknown,,Country Code,country code,1,92.4
idnumber,Unknown,,case number,case number,1,92.4
ir1,Unknown,,IR1. Interviewer's number,ir1. interviewer's number,1,132.0
ir10a,Unknown,,IR10a. Was the interview conducted with the assistance of an interpreter?,ir10a. was the interview conducted,1,132.0
ir11a,Unknown,,IR11a. What is the condition of the road leading to interviewee's residence?,ir11a. what is the condition,1,132.0
ir11b,Unknown,,IR11b. Please identify the main source of drinking water in the household?,ir11b. please identify the main,1,132.0
ir11c,Unknown,,IR11c. Is electricity the main source of lighting in the house?,ir11c. is electricity the main,1,132.0
ir11d,Unknown,,"IR11d. In terms of walking distance, how far is it between the nearest public transportation stop (bus, train, ferry, tram, etc) and the respondent's house?",ir11d. in terms of walking,1,132.0
ir12,Unknown,,"IR12. Were the following services present within the neighborhood (i.e., within walking or easy driving distance).Estimate the distance of these services by:",ir12. were the following services,1,132.0
ir12a,Unknown,,IR12a. Post-office,ir12a. post-office,1,92.4
ir12b,Unknown,,IR12b. School,ir12b. school,1,92.4
ir12c,Unknown,,IR12c. Police station,ir12c. police station,1,132.0
ir12d,Unknown,,IR12d. Sewerage system that most houses could access,ir12d. sewerage system that most,1,132.0
ir12e,Unknown,,IR12e. Health clinic,ir12e. health clinic,1,132.0
ir12f,Unknown,,IR12f. Signal for cellular phone,ir12f. signal for cellular phone,1,132.0
ir12g,Unknown,,"IR12g. Recreational facilities, e.g., a sports field","recreational facilities, e.g., a sports",1,132.0
ir12h,Unknown,,"IR12h. Any churches, mosques, temples or other public places of worship","ir12h. any churches, mosques, temples",1,132.0
ir12i,Unknown,,IR12i. Any town halls or community buildings that can be used for meetings,ir12i. any town halls or,1,132.0
ir12k,Unknown,,IR12k. Market stalls (selling groceries and/or clothing),ir12k. market stalls (selling groceries,1,132.0
ir13,Unknown,,IR13. Which of the following levels within the country the respondent live?,ir13. which of the following,1,132.0
ir2,Unknown,,IR2. Is this the first questionnaire you have completed?,ir2. is this the first,1,132.0
ir2a,Unknown,,IR2a. Interviewer's gender,ir2a. interviewer's gender,1,132.0
ir2b,Unknown,,IR2b. Interviewer's Age,ir2b. interviewer's age,1,132.0
ir2c,Unknown,,IR2c. What kind of language do you normally use at home?[Country-specific],ir2c. what kind of language,1,132.0
ir3,Unknown,,"IR3. In the interview, other than the respondent, were others present?","ir3. in the interview, other",1,132.0
ir3a,Unknown,,Who were they? (Multiple answers allowed),who were they? (multiple answers,1,132.0
ir3a_1HK,Unknown,,Respondent’s spouse,respondent’s spouse,1,92.4
ir3a_2HK,Unknown,,Children,children,2,50.0
ir3a_3HK,Unknown,,Parents or parents-in-law,parents or parents-in-law,1,132.0
ir3a_4HK,Social Perception,"neighbors, passersby",Neighbors/Passers by,neighbors/passers by,1,84.0
ir3a_5HK,Social Perception,"party, government official",Party/Government Official,party/government official,1,92.4
ir4,Survey Methodology,"refusal rate, non-response",IR4. Has the respondent ever refused to be interviewed during the whole process?,ir4. has the respondent ever,1,132.0
ir5,Survey Methodology,"impatience, response quality",IR5. Has the respondent ever felt impatient during the interview?,ir5. has the respondent ever,1,132.0
ir6,Survey Methodology,"cooperation, response quality",IR6. How cooperative was the respondent during the interview?,how cooperative was the respondent,1,132.0
ir7,Survey Methodology,"sincerity, response quality",IR7. How sincere was the respondent when answering sensitive questions?,how sincere was the respondent,1,132.0
ir8,Survey Methodology,"difficulty, response quality",IR8. What proportion of the questions do you feel the respondent had difficulty answering?,what proportion of the questions,1,132.0
ir9,Survey Methodology,"date of interview, data collection","Date of Interview____(month)____(date)_2010_(year) 

Variable: ir10 
  Question: IR10. Language in which interview was conducted",date of interview____(month)____(date)_2010_(year) variable: ir10,1,132.0
level3,Geography,"urban, rural",urban-rural,urban-rural,1,50.0
q1,Economic Perception,"economic condition, national level, current evaluation",q1. How would you rate the overall economic condition of our country today?  Is it …,q1. how would you rate,1,132.0
q10,Justice and Accountability,"justice, accountability, punishment","I'm going to name a number of institutions. For each one, please tell me how much trust do you have in them? Political parties [not any specific party]",you have in them? political,1,132.0
q100,Unknown,,"Now I am going to read to you a list of statements that describe how people often feel about the state of affairs in [country name]. Between elections, the people have no way of holding the government responsible for its actions.",affairs in [country name]. between,1,132.0
q101,Unknown,,"Now I am going to read to you a list of statements that describe how people often feel about the state of affairs in [country name]. When government leaders break the laws, there is nothing the court can do.",affairs in [country name]. when,1,132.0
q102,Unknown,,Now I am going to read to you a list of statements that describe how people often feel about the state of affairs in [country name]. Most citizens in our country don't make much effort to influence government decisions.,affairs in [country name]. most,1,132.0
q103,Unknown,,Now I am going to read to you a list of statements that describe how people often feel about the state of affairs in [country name]. All citizens from different ethnic communities in Country X are treated equally by the government.,affairs in [country name]. all,1,132.0
q104,Unknown,,Now I am going to read to you a list of statements that describe how people often feel about the state of affairs in [country name]. Rich and poor people are treated equally by the government.,affairs in [country name]. rich,1,132.0
q105,Unknown,,"Now I am going to read to you a list of statements that describe how people often feel about the state of affairs in [country name]. People have basic necessities like food, clothes, and shelter.",[country name]. people have basic,1,132.0
q106,Unknown,,Now I am going to read to you a list of statements that describe how people often feel about the state of affairs in [country name]. People are free to speak what they think without fear.,[country name]. people are free,1,132.0
q107,Unknown,,Now I am going to read to you a list of statements that describe how people often feel about the state of affairs in [country name]. People can join any organization they like without fear.,[country name]. people can join,1,132.0
q108,Unknown,,q108. Do officials who commit crimes go unpunished?,q108. do officials who commit,1,132.0
q109,Government Accountability,"officials' accountability, crime, government transparency",Do officials who commit crimes go unpunished? How often do government officials withhold important information from the public view?,unpunished? how often do government,1,132.0
q11,Trust in Institutions,"trust, evaluation, institutional assessment","I'm going to name a number of institutions. For each one, please tell me how much trust do you have in them? Parliament",you have in them? parliament,1,132.0
q110,Government Accountability,"officials' accountability, crime, government transparency",Do officials who commit crimes go unpunished? How often do you think government leaders break the law or abuse their power?,often do you think government,1,132.0
q111,Election Integrity,"elections, choice, democratic process",Do officials who commit crimes go unpunished? How often do you think our elections offer the voters a real choice between different parties/candidates?,often do you think our,1,132.0
q112,Legislative Power,"legislature, government leadership, checks and balances",q112. To what extent is the legislature capable of keeping government leaders in check?,q112. to what extent is,1,132.0
q113,Government Responsiveness,"government responsiveness, citizen needs, representation",q113. How well do you think the government responds to what people want?,you think the government responds,1,132.0
q114,Community Engagement,"community participation, local affairs, citizen voice","q114. In your neighborhood or community, do people voice their interests and concerns in local affairs?",q114. in your neighborhood or,1,132.0
q115,Government Accountability,"elections, government responsiveness, citizen influence",q115. How much do you feel that having elections makes the government pay attention to what the people think?,you feel that having elections,1,132.0
q116,Corruption,"corruption, bribery, local government",q116. How widespread do you think corruption and bribe-taking are in your local/municipal government?  Would you say …?,q116. how widespread do you,1,132.0
q117,Corruption,"corruption, bribery, national government",How widespread do you think corruption and bribe-taking are in your local/municipal government? How widespread do you think corruption and bribe-taking are in the national government [in capital city]?  Would you say …?,your local/municipal government? how widespread,1,132.0
q118,Trust in Government,"government performance, corruption, evaluation","q118. In your opinion, is the government working to crack down on corruption and root out bribery?","q118. in your opinion, is",1,132.0
q119,Perception of Corruption,"corruption, personal experience, social network",q119. Have you or anyone you know personally witnessed an act of corruption or bribe-taking by a politician or government official in the past year? IF WITNESSED: Did you personally witness it or were you told about it by a family member or friend who per,q119. have you or anyone,1,132.0
q119_1,Perception of Corruption,"corruption, personal experience",119_1 Personally witnessed,119_1 personally witnessed,1,132.0
q119_2,Perception of Corruption,"corruption, social network",119_2 Told about it by family member,told about it by family,1,132.0
q119_3,Perception of Corruption,"corruption, social network",119_3 Told about it by friend,told about it by friend,1,132.0
q12,Trust in Institutions,"trust, evaluation, institutional performance","I'm going to name a number of institutions. For each one, please tell me how much trust do you have in them? Civil service",you have in them? civil,1,132.0
q120,Perception of Democracy,"democracy, evaluation, country level",q120. Remember the scale that we used before: 1 means completely undemocratic and 10 means completely democratic. Where would you place China today on this scale?,q120. remember the scale that,1,132.0
q121,Perception of Democracy,"democracy, evaluation, country level",Remember the scale that we used before: 1 means completely undemocratic and 10 means completely democratic. Where would you place the United States today on this scale?,would you place the united,1,132.0
q122,Perception of Democracy,"democracy, evaluation, country level",Remember the scale that we used before: 1 means completely undemocratic and 10 means completely democratic. Where would you place Japan today on this scale?,where would you place japan,1,132.0
q123,Perception of Democracy,"democracy, evaluation, country level",Remember the scale that we used before: 1 means completely undemocratic and 10 means completely democratic. Where would you place India today on this scale?,where would you place india,1,132.0
q124,Economic Perception,"economic condition, evaluation, temporal comparison",q124. Which of the following statements comes closest to your own opinion?,q124. which of the following,1,132.0
q125,Economic Perception,"economic condition, evaluation, temporal comparison",q125. Which of the following statements comes closer to your own view?,q125. which of the following,1,132.0
q126,Value Prioritization,"democracy, economic development, value trade-off","q126. If you had to choose between democracy and economic development, which would you say is more important?",had to choose between democracy,1,132.0
q127,Value Prioritization,"economic inequality, political freedom, value trade-off","q127. If you had to choose between reducing economic inequality and protecting political freedom, which would you say is more important?",had to choose between reducing,1,132.0
q128,Economic Perception,"democracy, evaluation, temporal comparison","q128. Do you agree or disagree with the following statement: ""Democracy may have its problems, but it is still the best form of government.""",q128. do you agree or,1,132.0
q129,Government System,"government structure, institutional design, evaluation","q129. There are many ways to govern a country. Would you disapprove or approve of the following alternatives? For each statement, would you say you strongly approve, approve, disapprove, or strongly disapprove? We should get rid of parliament and election",q129. there are many ways,1,132.0
q129a_q131a,Unknown,,sum of Q129a_q131a(reject all authoritarian options),sum of q129a_q131a(reject all authoritarian,1,132.0
q13,Trust in Institutions,"institutional trust, evaluation, trust level","I'm going to name a number of institutions. For each one, please tell me how much trust do you have in them? The military(or armed forces)",have in them? the military(or,1,132.0
q130,Government System,"government structure, institutional design, evaluation",There are many ways to govern a country. Would you disapprove or approve of the following alternatives? Only one political party should be allowed to stand for election and hold office.,following alternatives? only one political,1,132.0
q130a,Unknown,,one poltical party,one poltical party,1,132.0
q131,Trust in Government,"governance, military intervention, evaluation",There are many ways to govern a country. Would you disapprove or approve of the following alternatives? The army (military) should come in to govern the country.,following alternatives? the army (military),1,132.0
q131a,Trust in Government,military governance,army,army,2,10.0
q132,Trust in Government,"governance, expertise, evaluation",There are many ways to govern a country. Would you disapprove or approve of the following alternatives? We should get rid of elections and parliaments and have experts make decisions on behalf of the people.,following alternatives? we should get,1,132.0
q133,Civic Engagement,"participation, politics, evaluation","q133. I have here some statements. For each statement, would you say you strongly agree, somewhat agree, somewhat disagree, or strongly disagree? I think I have the ability to participate in politics.",q133. i have here some,1,132.0
q134,Civic Engagement,"complexity, understanding, evaluation","I have here some statements. For each statement, would you say you strongly agree, somewhat agree, somewhat disagree, or strongly disagree? Sometimes politics and government seems so complicated that a person like me can't really understand what is going on.","disagree, or strongly disagree? sometimes",1,132.0
q135,Civic Engagement,"influence, evaluation","I have here some statements. For each statement, would you say you strongly agree, somewhat agree, somewhat disagree, or strongly disagree? People like me don't have any influence over what the government does.",or strongly disagree? people like,1,132.0
q136,Trust in Government,"trust, evaluation","I have here some statements. For each statement, would you say you strongly agree, somewhat agree, somewhat disagree, or strongly disagree? You can generally trust the people who run our government to do what is right.","disagree, or strongly disagree? you",1,132.0
q137,National Identity,"loyalty, country, evaluation","I have here some statements. For each statement, would you say you strongly agree, somewhat agree, somewhat disagree, or strongly disagree? A citizen should always remain loyal only to his country, no matter how imperfect it is or what wrong it has done.",or strongly disagree? a citizen,1,132.0
q138,Religious Influence,"government, religion, evaluation","I have here some statements. For each statement, would you say you strongly agree, somewhat agree, somewhat disagree, or strongly disagree? I have here other statements. For each statement, would you say you strongly agree, somewhat agree, somewhat disagree, or strongly disagree? The government should consult religious authorities when interpreting the laws.",or strongly disagree? i have,1,132.0
q139,Gender Equality,"politics, gender, evaluation","I have here some statements. For each statement, would you say you strongly agree, somewhat agree, somewhat disagree, or strongly disagree? Women should not be involved in politics as much as men.","disagree, or strongly disagree? women",1,132.0
q14,Trust in Institutions,"trust, evaluation, institutional level","I'm going to name a number of institutions. For each one, please tell me how much trust do you have in them? The police",have in them? the police,1,132.0
q140,Social Attitudes,"equality, education, politics","I have here some statements. For each statement, would you say you strongly agree, somewhat agree, somewhat disagree, or strongly disagree? People with little or no education should have as much say in politics as highly-educated people.",strongly disagree? people with little,1,132.0
q141,Social Attitudes,"authority, decision-making, leadership","I have here some statements. For each statement, would you say you strongly agree, somewhat agree, somewhat disagree, or strongly disagree? Government leaders are like the head of a family; we should all follow their decisions.","disagree, or strongly disagree? government",1,132.0
q141a,Social Attitudes,"authority, leadership",government leader,government leader,5,8.264507244839223
q141a_q147a,Authoritarian Values,"authoritarianism, values",average rejection of authoritarian values,average rejection of authoritarian values,1,132.0
q142,Social Attitudes,"censorship, freedom of speech, government control","I have here some statements. For each statement, would you say you strongly agree, somewhat agree, somewhat disagree, or strongly disagree? The government should decide whether certain ideas should be allowed to be discussed in society.",disagree? the government should decide,1,132.0
q142a,Social Attitudes,"censorship, ideas",certain ideas,certain ideas,2,32.66833329081849
q143,Social Attitudes,"community harmony, group organization","I have here some statements. For each statement, would you say you strongly agree, somewhat agree, somewhat disagree, or strongly disagree? Harmony of the community will be disrupted if people organize lots of groups.","disagree, or strongly disagree? harmony",1,132.0
q143a,Social Attitudes,community harmony,Harmony of the community,harmony of the community,2,46.66904755831214
q144,Judicial System,"judicial independence, executive branch","I have here some statements. For each statement, would you say you strongly agree, somewhat agree, somewhat disagree, or strongly disagree? When judges decide important cases, they should accept the view of the executive branch.",or strongly disagree? when judges,1,132.0
q144a,Trust in Government,"judges, evaluation, temporal comparison",judges,judges,2,50.0
q145,Trust in Government,"government oversight, evaluation, temporal comparison","I have here some statements. For each statement, would you say you strongly agree, somewhat agree, somewhat disagree, or strongly disagree? If the government is constantly checked [i.e. monitored and supervised] by the legislature, it cannot possibly accomplish great things.",strongly disagree? if the government,1,132.0
q145a,Trust in Government,"government oversight, evaluation, temporal comparison",checked by the legislature,checked by the legislature,1,132.0
q146,Trust in Government,"political leadership, evaluation, temporal comparison","I have here some statements. For each statement, would you say you strongly agree, somewhat agree, somewhat disagree, or strongly disagree? If we have political leaders who are morally upright, we can let them decide everything.",or strongly disagree? if we,1,132.0
q146a,Trust in Government,"political leadership, evaluation, temporal comparison",political leaders,political leaders,2,32.66833329081849
q147,Social Cohesion,"cultural diversity, societal order, evaluation","I have here some statements. For each statement, would you say you strongly agree, somewhat agree, somewhat disagree, or strongly disagree? If people have too many different ways of thinking, society will be chaotic.",or strongly disagree? if people,1,132.0
q147a,Social Cohesion,"societal order, evaluation, temporal comparison",chaotic,chaotic,2,50.0
q148,Rule of Law,"government accountability, evaluation, temporal comparison","I have here some statements. For each statement, would you say you strongly agree, somewhat agree, somewhat disagree, or strongly disagree? When the country is facing a difficult situation, it is ok for the government to disregard the law in order to deal with the situation.",strongly disagree? when the country,1,132.0
q149,Global Awareness,"global events, evaluation, temporal comparison",q149. How closely do you follow major events in foreign countries / the world?,q149. how closely do you,1,132.0
q15,Trust in Institutions,"local government, evaluation, temporal comparison","I'm going to name a number of institutions. For each one, please tell me how much trust do you have in them? Local government",you have in them? local,1,132.0
q150,Media Consumption,"media consumption, foreign content, frequency","q150. How often do you watch or listen to foreign programs (television, DVDs, movies, radio)?",q150. how often do you,1,132.0
q151,National Identity,"national identity, cultural values, comparison",q151. Our country should defend our way of life instead of becoming more and more like other countries.,q151. our country should defend,1,132.0
q152,Protectionism,"protectionism, import policy, evaluation","q152. Do you agree or disagree with the following statement: ""We should protect our farmers and workers by limiting the import of foreign goods.""",q152. do you agree or,1,132.0
q153,Protectionism,"protectionism, import policy, evaluation","Do you agree or disagree with the following statement: ""We should protect our farmers and workers by limiting the import of foreign goods."" Do you agree or disagree with the following statement: ""Foreign goods are hurting the local community.""","import of foreign goods."" do",1,132.0
q154,National Pride,"national pride, citizenship, evaluation",q154. How proud are you to be a citizen of (COUNTRY)?,q154. how proud are you,1,132.0
q155,Migration,"migration, willingness, temporal comparison","q155. Given the chance, how willing would you be to go and live in another country?","q155. given the chance, how",1,132.0
q156,Regional Influence,"regional influence, country comparison, evaluation",q156. Which country has the most influence in Asia?,country has the most influence,1,132.0
q157,Regional Influence,"regional influence, country comparison, evaluation","q157. Does (answer in Q156) do more good or harm to the region? Ask Q157a if the answer in Q156 is not China, otherwise skip to Q158",q157. does (answer in q156),1,132.0
q157a,Regional Influence,"regional influence, country comparison, evaluation",Does (answer in Q156) do more good or harm to the region? Does China do more good or harm to the region?,harm to the region? does,2,46.66904755831214
q157b,Regional Influence,"regional influence, country comparison, evaluation",Does (answer in Q156) do more good or harm to the region? Does China do more good or harm to the region? (Whether the most influence country is China or not.),harm to the region? (whether,1,132.0
q158,International Relations/Global Influence,"country influence, temporal comparison, geographical scope","q158. In ten years, which country will have the most influence in Asia?","q158. in ten years, which",1,132.0
q159,International Relations/Global Influence,"country model, future development, evaluation",q159. Which country should be a model for our own country's future development?,q159. which country should be,1,132.0
q16,Trust in Institutions,"institutional trust, evaluation","I'm going to name a number of institutions. For each one, please tell me how much trust do you have in them? Newspapers",you have in them? newspapers,1,132.0
q160,International Relations/China's Influence,"country influence, evaluation",q160. How much influence does China have on our country?,q160. how much influence does,1,132.0
q161,International Relations/China's Influence,"country influence, evaluation","q161. General speaking, the influence China has on our country is?","q161. general speaking, the influence",1,132.0
q17,Trust in Institutions,"institutional trust, evaluation","I'm going to name a number of institutions. For each one, please tell me how much trust do you have in them? Television",you have in them? television,1,132.0
q18,Trust in Institutions,"institutional trust, evaluation","I'm going to name a number of institutions. For each one, please tell me how much trust do you have in them? The election commission [specify institution by name] <Optional>",have in them? the election,1,132.0
