variable_id,domain,concepts,question_text,validation_phrase,validation_phrase_occurrences,validation_phrase_score
q50,Unknown,,"Please tell me how you feel about the following statements. Would you say you strongly agree, somewhat agree, somewhat disagree, or strongly disagree? For the sake of the family, the individual should put his personal interests second",strongly disagree? for,1,100.0
q51,Unknown,,"q51. In a group, we should sacrifice our individual interest for the sake of the group's collective interest.",q51. in a,1,100.0
q52,Unknown,,"q52. For the sake of national interest, individual interest could be sacrificed.",q52. for the,1,100.0
q53,Unknown,,"For the sake of national interest, individual interest could be sacrificed. When dealing with others, developing a long-term relationship is more important than securing one's immediate interest.","with others, developing",1,100.0
q54,Unknown,,"For the sake of national interest, individual interest could be sacrificed. When dealing with others, one should not only focus on immediate interest but also plan for future.",should not only,1,100.0
q55,Unknown,,"For the sake of national interest, individual interest could be sacrificed. Even if parents' demands are unreasonable, children still should do what they ask.",even if parents',1,100.0
q56,Unknown,,"For the sake of national interest, individual interest could be sacrificed. When a mother-in-law and a daughter-in-law come into conflict, even if the mother-in-law is in the wrong, the husband should still persuade his wife to obey his mother.",sacrificed. when a,1,100.0
q57,Unknown,,"For the sake of national interest, individual interest could be sacrificed. Being a student, one should not question the authority of their teacher.",be sacrificed. being,1,100.0
q58,Unknown,,"For the sake of national interest, individual interest could be sacrificed. In a group, we should avoid open quarrel to preserve the harmony of the group",be sacrificed. in,1,100.0
q59,Unknown,,"For the sake of national interest, individual interest could be sacrificed. Even if there is some disagreement with others, one should avoid the conflict",even if there,1,100.0
q6,Unknown,,q6. What do you think the economic situation of your family will be a few years from now? Will it be …,q6. what do,1,100.0
q60,Unknown,,"For the sake of national interest, individual interest could be sacrificed. A person should not insist on his own opinion if his co-workers disagree with him",be sacrificed. a,1,100.0
q61,Unknown,,"For the sake of national interest, individual interest could be sacrificed. Wealth and poverty, success and failure are all determined by fate.",be sacrificed. wealth,1,100.0
q62,Unknown,,"For the sake of national interest, individual interest could be sacrificed. If one could have only one child, it is more preferable to have a boy than a girl.",be sacrificed. if,1,100.0
q63,Unknown,,"For the sake of national interest, individual interest could be sacrificed. When dealing with others, one should not be preoccupied with temporary gains and losses.",not be preoccupied,1,100.0
q64,Unknown,,"q64. In the past three (3) years, have you never, once, or more than once done the following because of personal, family, or neighborhood problems, or problems with government officials and policies?Contacted elected officials or legislative representativ",q64. in the,1,100.0
q65,Unknown,,"In the past three (3) years, have you never, once, or more than once done the following because of personal, family, or neighborhood problems, or problems with government officials and policies?Contacted elected officials or legislative representativ Contacted officials at higher level.",representativ contacted officials,1,100.0
q66,Unknown,,"In the past three (3) years, have you never, once, or more than once done the following because of personal, family, or neighborhood problems, or problems with government officials and policies?Contacted elected officials or legislative representativ Contacted traditional leaders/community leaders.",representativ contacted traditional,1,100.0
q67,Unknown,,"In the past three (3) years, have you never, once, or more than once done the following because of personal, family, or neighborhood problems, or problems with government officials and policies?Contacted elected officials or legislative representativ Contacted other influential people outside the government",representativ contacted other,1,100.0
q68,Unknown,,"In the past three (3) years, have you never, once, or more than once done the following because of personal, family, or neighborhood problems, or problems with government officials and policies?Contacted elected officials or legislative representativ Contacted news media",representativ contacted news,1,100.0
q69,Unknown,,"In the past three (3) years, have you never, once, or more than once done the following because of personal, family, or neighborhood problems, or problems with government officials and policies?Contacted elected officials or legislative representativ Here is a list of actions that people sometimes take as citizens. For each of these, please tell me whether you, personally, have never, once, or more than once done any of these things during the past three years.   Got together with others to try t",legislative representativ here,1,100.0
q7,Unknown,,"q7. I'm going to name a number of institutions. For each one, please tell me how much trust do you have in them? The president",q7. i'm going,1,100.0
q70,Unknown,,"In the past three (3) years, have you never, once, or more than once done the following because of personal, family, or neighborhood problems, or problems with government officials and policies?Contacted elected officials or legislative representativ Got together with others to raise an issue or sign a petition",legislative representativ got,1,100.0
q71,Unknown,,"In the past three (3) years, have you never, once, or more than once done the following because of personal, family, or neighborhood problems, or problems with government officials and policies?Contacted elected officials or legislative representativ Attended a demonstration or protest march",legislative representativ attended,1,100.0
q72,Unknown,,"In the past three (3) years, have you never, once, or more than once done the following because of personal, family, or neighborhood problems, or problems with government officials and policies?Contacted elected officials or legislative representativ Used force or violence for a political cause",legislative representativ used,1,100.0
q73,Unknown,,"q73. Thinking of whether you voted or not ever since you became eligible for voting, how would you describe yourself -have you voted in every election, voted in most elections, voted in some elections or hardly ever voted?",q73. thinking of,1,100.0
q74,Unknown,,"q74. Let's talk for a moment about the kind of government you would like to have in this country, which of the followings statements do you agree with most? Choose the first or the second statement. [Interviewer: Probe whether respondent strongly agrees o",q74. let's talk,1,100.0
q74a,Unknown,,q74a. Do you strongly agree or just agree with the chosen statement?,q74a. do you,1,100.0
q75,Unknown,,"q75. Let's talk for a moment about the kind of government you would like to have in this country, which of the followings statements do you agree with most? Choose the first or the second statement. [Interviewer: Probe whether respondent strongly agrees o",q75. let's talk,1,100.0
q75a,Unknown,,q75a. Do you strongly agree or just agree with the chosen statement?,q75a. do you,1,100.0
q76,Unknown,,"q76. Let's talk for a moment about the kind of government you would like to have in this country, which of the followings statements do you agree with most? Choose the first or the second statement. [Interviewer: Probe whether respondent strongly agrees o",q76. let's talk,1,100.0
q76a,Unknown,,q76a. Do you strongly agree or just agree with the chosen statement?,q76a. do you,1,100.0
q77,Unknown,,"q77. Let's talk for a moment about the kind of government you would like to have in this country, which of the followings statements do you agree with most? Choose the first or the second statement. [Interviewer: Probe whether respondent strongly agrees o",q77. let's talk,1,100.0
q77a,Unknown,,q77a. Do you strongly agree or just agree with the chosen statement?,q77a. do you,1,100.0
q78,Unknown,,"q78. Let's talk for a moment about the kind of government you would like to have in this country, which of the followings statements do you agree with most? Choose the first or the second statement. [Interviewer: Probe whether respondent strongly agrees o",q78. let's talk,1,100.0
q78a,Unknown,,q78a. Do you strongly agree or just agree with the chosen statement?,q78a. do you,1,100.0
q79,Unknown,,"q79. Let's talk for a moment about the kind of government you would like to have in this country, which of the followings statements do you agree with most? Choose the first or the second statement. [Interviewer: Probe whether respondent strongly agrees o",q79. let's talk,1,100.0
q79a,Unknown,,q79a. Do you strongly agree or just agree with the chosen statement?,q79a. do you,1,100.0
q8,Unknown,,"I'm going to name a number of institutions. For each one, please tell me how much trust do you have in them? The courts",them? the courts,1,100.0
q80,Unknown,,"q80. Over the long run, our system of government is capable of solving the problems our country faces.",q80. over the,1,100.0
q81,Unknown,,"Over the long run, our system of government is capable of solving the problems our country faces. Thinking in general, I am proud of our system of government.",country faces. thinking,1,100.0
q82,Unknown,,"Over the long run, our system of government is capable of solving the problems our country faces. A system like ours, even if it runs into problems, deserves the people's support.",country faces. a,1,100.0
q83,Unknown,,"Over the long run, our system of government is capable of solving the problems our country faces. I would rather live under our system of government than any other that I can think of.",country faces. i,1,100.0
q84,Unknown,,"q84. Compared with other systems in the world, would you say our system of government works fine as it is, needs minor change, needs major change, or should be replaced?",q84. compared with,1,100.0
q85,Unknown,,"q85. Many things may be desirable, but not all of them are essential characteristics of democracy. If you have to choose only one from each four sets of statements that I am going to read, which one would you choose as the most essential characteristics o",q85. many things,1,100.0
q86,Unknown,,"q86. If you have to choose only one from each four sets of statements that I am going to read, which one would you choose as the most essential characteristics of a democracy?",q86. if you,1,100.0
q87,Unknown,,"q87. If you have to choose only one from each four sets of statements that I am going to read, which one would you choose as the most essential characteristics of a democracy?",q87. if you,1,100.0
q88,Unknown,,"q88. If you have to choose only one from each four sets of statements that I am going to read, which one would you choose as the most essential characteristics of a democracy?",q88. if you,1,100.0
q89,Unknown,,"q89. On the whole, how satisfied or dissatisfied are you with the way democracy works in [Country].  Are you …?",q89. on the,1,100.0
q9,Unknown,,"I'm going to name a number of institutions. For each one, please tell me how much trust do you have in them? The national government [in capital city]",them? the national,1,100.0
q90,Unknown,,q90. In your opinion how much of a democracy is [Country Name] ?,q90. in your,1,100.0
q91,Unknown,,q91. Here is a scale: 1 means completely undemocratic and 10 means completely democratic. Where would you place our country under the present government?,q91. here is,1,100.0
q92,Unknown,,Here is a scale: 1 means completely undemocratic and 10 means completely democratic. Where would you place our country ten years ago?,our country ten,1,100.0
q93,Unknown,,Here is a scale: 1 means completely undemocratic and 10 means completely democratic. Where would you want our country to be in the future?,would you want,1,100.0
q94,Unknown,,"Here is a scale: 1 means completely undemocratic and 10 means completely democratic. Here is a similar scale of 1 to 10 measuring the extent to which people think democracy is suitable for our country. If ""1"" means that democracy is completely unsuitable for [name of country] today and ""10"" means that it is completely suitable, where",completely democratic. here,1,100.0
q95,Unknown,,"q95. How satisfied or dissatisfied are you with the [name of president, etc. ruling current] government?  Are you …?",q95. how satisfied,1,100.0
q96,Unknown,,"q96. In your opinion, what are the most important problems facing this country that government should address?",q96. in your,1,100.0
q97,Unknown,,q97. How likely is it that the government will solve the most important problem you identified within the next five years? [Read out options],q97. how likely,1,100.0
q98,Unknown,,"q98. Now I am going to read to you a list of statements that describe how people often feel about the state of affairs in [country name]. Please tell me whether you strongly agree, somewhat agree, somewhat disagree, or strongly disagree with each of these",q98. now i,1,100.0
q99,Unknown,,Now I am going to read to you a list of statements that describe how people often feel about the state of affairs in [country name]. Political parties or candidates in our country have equal access to the mass media during the election period.,[country name]. political,1,100.0
se10,Unknown,,SE10. Are you the main earner in your household?(Chief wage earner)<Optional>,se10. are you,1,100.0
se10_1,Unknown,,SE10_1. Is the main earner in your household currently employed?,se10_1. is the,1,100.0
se10a,Unknown,,"SE10a. Is he or she currently self-employed (including business owners), working in a family business, or working for an outsid",se10a. is he,1,100.0
se10b,Unknown,,SE10b. How many people do his or her business employ?,se10b. how many,1,100.0
se10c,Unknown,,SE10c. What is his or her job title and job description?<The code number of ISCO>,se10c. what is,1,100.0
se10d,Unknown,,SE10d. Is he or she currently seeking employment?,se10d. is he,1,100.0
se10e,Unknown,,SE10e. What is his or her current status?,se10e. what is,1,100.0
se11,Unknown,,SE11. LANGUAGE: What language do you speak the most in the home?,se11. language: what,1,100.0
se12,Unknown,,SE12. SUBJECTIVE SOCIAL STATUS,se12. subjective social,1,100.0
se13,Unknown,,SE13. HOUSEHOLD INCOME,se13. household income,1,100.0
se13a,Unknown,,SE13a. Does the total income of your household allow you to satisfactorily cover your needs?,se13a. does the,1,100.0
se14a,Unknown,,SE14a. Car/Jeep/Van,se14a. car/jeep/van,1,80.0
se14b,Unknown,,SE14b. Tractor,se14b. tractor,1,80.0
se14c,Unknown,,SE14c. Television,se14c. television,1,80.0
se14d,Unknown,,SE14d. Cable Television,se14d. cable television,1,100.0
se14e,Unknown,,SE14e. Motorcycle,se14e. motorcycle,1,80.0
se14f,Unknown,,SE14f. Telephone,se14f. telephone,1,80.0
se14g,Unknown,,SE14g. Mobile Phone,se14g. mobile phone,1,100.0
se14h,Unknown,,SE14h. Electric Fan,se14h. electric fan,1,100.0
se14i,Unknown,,SE14i. Bicycle,se14i. bicycle,1,80.0
se14j,Unknown,,SE14j. Radio,se14j. radio,1,80.0
se14k,Unknown,,SE14k. Pumping Set,se14k. pumping set,1,100.0
se14l,Unknown,,SE14l. Fridge,se14l. fridge,1,80.0
se14m,Unknown,,SE14m. Camera,se14m. camera,1,80.0
se14n,Unknown,,SE14n. Goats/Sheep,se14n. goats/sheep,1,80.0
se14o,Unknown,,SE14o. Cow/Buffalo,se14o. cow/buffalo,1,80.0
se2,Unknown,,SE2. GENDER,se2. gender,1,80.0
se3,Unknown,,SE3. BIRTH YEAR,se3. birth year,1,100.0
se3a,Unknown,,SE3a.ACTUAL AGE,se3a.actual age,1,80.0
se3a_1a,Unknown,,age group,age group,1,80.0
se4,Unknown,,SE4. MARITAL STATUS,se4. marital status,1,100.0
se5,Unknown,,SE5. EDUCATION,se5. education,1,80.0
se5a,Unknown,,SE5a. How many years of formal education you have received?,se5a. how many,1,100.0
se6,Unknown,,SE6. RELIGION,se6. religion,1,80.0
se7,Unknown,,SE7. RELIGIOSITY: About how often do you practice religious services or rituals these days?,se7. religiosity: about,1,100.0
se7a,Unknown,,"SE7a. Would you describe yourself as very religious, moderately religious, lightly religious, not religious at all?",se7a. would you,1,100.0
se8a,Unknown,,SE8a. How many people live in this household?,se8a. how many,1,100.0
se8b,Unknown,,SE8b. How many generations of family members live in this household?,se8b. how many,1,100.0
se8c,Unknown,,"Actual count(INCLUDE servants, transients/boarders)","actual count(include servants,",1,100.0
se8d,Unknown,,"Actual count(EXCLUDE servants, transients/boarders)","actual count(exclude servants,",1,100.0
se9,Unknown,,SE9. Are you currently employed?(respondent),se9. are you,1,100.0
se9a,Unknown,,"SE9a. Are you currently self-employed (including business owners), working in a family business, or working for an outside emp",se9a. are you,1,100.0
se9b,Unknown,,SE9b. How many people does your business employ?,se9b. how many,1,100.0
se9c,Unknown,,SE9c. What is your job title and job description?<The code number of ISCO>,se9c. what is,1,100.0
se9d,Unknown,,SE9d. Are you currently seeking employment?,se9d. are you,1,100.0
se9e,Unknown,,SE9e. What is your current status?,se9e. what is,1,100.0
